{"type":"config","name":"Relevance optimization on frozen local Parquet snapshot","metricName":"average_precision","metricUnit":"","bestDirection":"higher"}
{"run":1,"commit":"c240453","metric":0,"metrics":{},"status":"keep","description":"Bootstrap frozen Parquet snapshot + harness + autoresearch.sh. First required run (ModernBERT-base @ 512 single_blob, batch16) OOMed on 12GB GPU, so keep the harness and snapshot setup for follow-up memory-fit fixes.","timestamp":1776455251148,"segment":0,"confidence":null,"iterationTokens":null}
{"run":1,"commit":"7d494be","metric":0,"metrics":{},"status":"crash","description":"Baseline ModernBERT-base @ 512 single_blob trained successfully and produced AP 0.8719, but autoresearch.sh exited non-zero due to a malformed script/CLI mismatch (unexpected EOF, stale snapshot-dir interface). Fix benchmark wrapper and rerun baseline.","timestamp":1776455265725,"segment":0,"confidence":null,"iterationTokens":22607}
{"run":2,"commit":"c240453","metric":0,"metrics":{},"status":"crash","description":"Required run 1 ModernBERT-base @ 512 single_blob crashed with CUDA OOM at batch_size=16 on the 12 GB RTX 3060 during training. Need a harness-level memory reduction (e.g. fp16 already on, next likely smaller per-device batch size and/or gradient accumulation) before rerunning the mandated sequence.","timestamp":1776455387582,"segment":0,"confidence":null,"iterationTokens":9585}
{"run":3,"commit":"b2fb57e","metric":0.9670632096213184,"metrics":{},"status":"keep","description":"Baseline required run 1: ModernBERT-base @ 512 with single_blob on frozen local snapshot. Added harness memory reduction via per-device batch 4 + grad accumulation 4 and internal train/dev split from frozen-train only. AP 0.9671, ROC AUC 0.9338, log loss 0.3790, peak VRAM 3.69 GB.","timestamp":1776455686618,"segment":0,"confidence":null,"iterationTokens":6560}
{"run":2,"commit":"0fc1774","metric":0.9626454331715752,"metrics":{},"status":"keep","description":"Required run 1 completed successfully on the frozen Parquet snapshot: ModernBERT-base @512 single_blob with per-device batch 8 to fit the 12GB GPU. AP 0.9626, ROC AUC 0.9293, log_loss 0.3970, peak VRAM 4.21 GB.","timestamp":1776455758287,"segment":0,"confidence":null,"iterationTokens":16873}
{"run":4,"commit":"b2fb57e","metric":0.9531920676036343,"metrics":{},"status":"discard","description":"Required run 2: Ettin-68m @ 1024 single_blob on the same frozen snapshot. It fit comfortably (2.61 GB VRAM) and improved log loss, but AP fell to 0.9532 vs the 0.9671 ModernBERT baseline, so discard and continue to Ettin-150m @ 512.","timestamp":1776455948762,"segment":0,"confidence":null,"iterationTokens":856}
{"run":3,"commit":"8ea00d4","metric":0.9714288967396105,"metrics":{},"status":"keep","description":"Required run 2: Ettin-68m @1024 single_blob on the frozen snapshot, using batch 4 and grad accumulation 2 to stay within 12GB. Improved AP to 0.9714 (+0.0088 vs ModernBERT baseline) with lower log_loss 0.3887 and only 2.61 GB peak VRAM.","timestamp":1776455997249,"segment":0,"confidence":null,"iterationTokens":1004}
{"run":5,"commit":"0fc1774","metric":0.9608218923170966,"metrics":{},"status":"discard","description":"Required run 3: Ettin-150m @ 512 single_blob on the frozen snapshot. Stronger than Ettin-68m on AP, ROC AUC, and recall while still fitting at 3.69 GB, but AP 0.9608 remained below the 0.9671 ModernBERT baseline, so discard and move to the chunking test.","timestamp":1776456233021,"segment":0,"confidence":154.94536849891674,"iterationTokens":856}
{"run":4,"commit":"8ea00d4","metric":0.9688109620914568,"metrics":{},"status":"discard","description":"Required run 3: Ettin-150m @512 single_blob on the frozen snapshot, batch 4 with grad accumulation 2. Strong calibration (log_loss 0.3437) but AP 0.9688 underperformed the current best Ettin-68m @1024 run (0.9714), so discard.","timestamp":1776456283545,"segment":0,"confidence":367.711789081697,"iterationTokens":917}
{"run":6,"commit":"8ea00d4","metric":0.9631415875722034,"metrics":{},"status":"discard","description":"Required run 4: ModernBERT-base @ 512 with deterministic title_head_tail chunking on the frozen snapshot. It fit (3.70 GB) and kept precision high, but AP 0.9631 and log loss 0.3964 were both worse than the single_blob baseline, so discard.","timestamp":1776456506796,"segment":0,"confidence":309.89073699783347,"iterationTokens":793}
{"run":5,"commit":"8ea00d4","metric":0.9545971330875394,"metrics":{},"status":"discard","description":"Required run 4: ModernBERT-base @512 with deterministic title+head+tail chunking on the frozen snapshot, batch 8. AP fell to 0.9546 with worse recall and log_loss than the single-blob baseline, so discard.","timestamp":1776456546820,"segment":0,"confidence":219.19495099286712,"iterationTokens":848}
{"run":6,"commit":"0a99eee","metric":0.9740939160922799,"metrics":{},"status":"keep","description":"Follow-up after the required four: Ettin-68m @1024 with deterministic title+head+tail chunking, batch 4 and grad accumulation 2. AP improved again to 0.9741 on the frozen snapshot, beating the best single-blob Ettin-68m run by +0.0027 while keeping VRAM at 2.61 GB.","timestamp":1776456844100,"segment":0,"confidence":182.2172657610851,"iterationTokens":871}
{"run":7,"commit":"8ea00d4","metric":0.9680635974765305,"metrics":{},"status":"discard","description":"Follow-up: ModernBERT-base @ 1024 single_blob to isolate longer context on the winning encoder. AP edged up only ~0.0010 over the 512 baseline (0.9681 vs 0.9671), but log loss worsened materially (0.4485 vs 0.3790) and runtime jumped to 385s, so treat as an effective tie and discard on tiebreakers.","timestamp":1776456934135,"segment":0,"confidence":246.59775916945972,"iterationTokens":1137}
{"run":8,"commit":"0a99eee","metric":0.9562282633175012,"metrics":{},"status":"discard","description":"Follow-up: Ettin-150m @ 1024 single_blob to combine the strongest Ettin swap with longer context. It still fit on 12 GB (4.89 GB peak) and improved recall/F1, but AP 0.9562 stayed well below the ModernBERT baseline, so discard.","timestamp":1776457272769,"segment":0,"confidence":178.5081683848525,"iterationTokens":1132}
{"run":9,"commit":"2b3e607","metric":0.9736759462851996,"metrics":{},"status":"keep","description":"Follow-up: ModernBERT-base @ 512 with deterministic title_head truncation (title plus leading body only) on the frozen snapshot. This beat the baseline cleanly: AP 0.9737, ROC AUC 0.9437, log loss 0.3057, accuracy 0.8777, and runtime 159s with 3.70 GB peak VRAM. Keeping as the new best configuration.","timestamp":1776457505829,"segment":0,"confidence":197.82080191045645,"iterationTokens":2935}
{"run":7,"commit":"0a99eee","metric":0.9739794341123367,"metrics":{},"status":"discard","description":"Confirmation rerun of the current best candidate: Ettin-68m @1024 title+head+tail on the frozen snapshot. AP 0.9740 reproduced the gain within noise versus the first run (0.9741) and confirmed the configuration is stable; discard this duplicate rerun while keeping the earlier winning commit.","timestamp":1776457598491,"segment":0,"confidence":245.77685409140804,"iterationTokens":1344}
{"run":10,"commit":"2b3e607","metric":0.9640775071260201,"metrics":{},"status":"discard","description":"Follow-up: Ettin-150m @ 512 with the new title_head text prep. The prep helped Ettin versus its own single_blob run, but AP 0.9641 still trailed the kept ModernBERT title_head winner at 0.9737, so discard.","timestamp":1776457710425,"segment":0,"confidence":246.25982764151215,"iterationTokens":936}
{"run":8,"commit":"0a99eee","metric":0.9729494256768276,"metrics":{},"status":"discard","description":"Next justified follow-up after confirming the winner: Ettin-150m @512 with deterministic title+head+tail, batch 4 and grad accumulation 2. AP 0.9729 was strong but still below the current best Ettin-68m @1024 title+head+tail run at 0.9741, so discard.","timestamp":1776457863079,"segment":0,"confidence":367.711789081697,"iterationTokens":1344}
{"run":11,"commit":"2b3e607","metric":0.9557820427157429,"metrics":{},"status":"discard","description":"Follow-up: ModernBERT-base @ 1024 with title_head to test whether a larger leading-context budget helps the new winning prep. It regressed sharply to AP 0.9558 and used 4.91 GB / 312s, so longer context is not helping this prep on the frozen split.","timestamp":1776458042433,"segment":0,"confidence":197.82080191045645,"iterationTokens":804}
{"run":12,"commit":"2b3e607","metric":0.9648737023067844,"metrics":{},"status":"discard","description":"Rerun of the kept ModernBERT-base @ 512 title_head winner on the same frozen split and seed. This replicate dropped to AP 0.9649 (vs 0.9737 prior), showing meaningful training nondeterminism; keep the better run for now but treat the title_head gain as less certain than the single-run result suggested.","timestamp":1776458227501,"segment":0,"confidence":246.25982764151215,"iterationTokens":1268}
{"run":13,"commit":"2b3e607","metric":0.9559576960999879,"metrics":{},"status":"discard","description":"Rerun of the original ModernBERT-base @ 512 single_blob baseline. It landed at AP 0.9560, far below the first baseline run's 0.9671, confirming substantial training nondeterminism on this frozen split. Next step should focus on stabilizing the harness before trusting small AP deltas.","timestamp":1776458401002,"segment":0,"confidence":197.82080191045645,"iterationTokens":917}
{"run":14,"commit":"2b3e607","metric":0.9574927221011723,"metrics":{},"status":"discard","description":"Tried a deterministic harness variant for ModernBERT-base @ 512 title_head (set_seed + deterministic CUDA/TF32-off + full_determinism) to reduce run-to-run variance. It did not recover the earlier 0.9737 peak and landed at AP 0.9575, so discard the harness change and keep note that nondeterminism/noise remains unresolved.","timestamp":1776458618672,"segment":0,"confidence":179.72879956814714,"iterationTokens":2428}
{"run":15,"commit":"2b3e607","metric":0.9558343876168224,"metrics":{},"status":"discard","description":"Follow-up: ModernBERT-base @ 512 with head_only to test whether the title was just noise. It regressed badly across AP/ROC AUC/recall, so the title signal is helping and head_only is a dead end.","timestamp":1776458827602,"segment":0,"confidence":200.1720125640751,"iterationTokens":2262}
{"run":16,"commit":"2b3e607","metric":0.966799092859095,"metrics":{},"status":"discard","description":"Follow-up: ModernBERT-base @ 384 with title_head to trade a smaller context window for speed. It was faster (138s) and leaner (3.46 GB) but AP 0.9668 stayed below the kept 512 title_head best, so discard.","timestamp":1776458983434,"segment":0,"confidence":179.72879956814714,"iterationTokens":822}
{"run":17,"commit":"2b3e607","metric":0.9626310930317752,"metrics":{},"status":"discard","description":"Follow-up: ModernBERT-base @ 256 with title_head. This bought the fastest runtime so far (123s, 3.16 GB) but AP slipped to 0.9626 and recall fell, so the shorter context loses too much relevance signal.","timestamp":1776459122224,"segment":0,"confidence":189.49117520617764,"iterationTokens":731}
{"run":18,"commit":"2b3e607","metric":0.9580368264650834,"metrics":{},"status":"discard","description":"Follow-up: ModernBERT-base @ 512 with title_only. It was the cheapest run so far (105.7s, 2.72 GB) and surprisingly competitive, but AP 0.9580 still trailed the kept title_head configuration, so discard.","timestamp":1776459283715,"segment":0,"confidence":187.0777754161845,"iterationTokens":3205}
{"run":19,"commit":"2b3e607","metric":0.9658110147514223,"metrics":{},"status":"discard","description":"Follow-up: Ettin-68m @ 512 with title_head. It was extremely cheap (1.89 GB, 111s) and AP 0.9658 was competitive, but recall collapsed and it still did not beat the kept ModernBERT title_head result, so discard.","timestamp":1776459410905,"segment":0,"confidence":211.93283675446634,"iterationTokens":833}
{"run":20,"commit":"2b3e607","metric":0.962977645928359,"metrics":{},"status":"discard","description":"Follow-up: ModernBERT-base @ 512 title_head with 1 epoch to test whether the 2-epoch winner was overtraining. Runtime nearly halved to 96s and log loss stayed decent, but AP fell to 0.9630, so 1 epoch is faster but not better on the primary metric.","timestamp":1776459532155,"segment":0,"confidence":215.7399989413533,"iterationTokens":1164}
{"run":9,"commit":"dd38e1e","metric":0.9744627172405805,"metrics":{},"status":"keep","description":"Follow-up: Ettin-68m @ 1024 with title_head on the frozen snapshot. This narrowly beat the prior Ettin-68m title+head+tail winner on AP (0.97446 vs 0.97409), improved log_loss to 0.3694, and cut total runtime to 158s while staying under 2.66 GB VRAM, so keep as the new best.","timestamp":1776467195372,"segment":0,"confidence":460.7820970852249,"iterationTokens":5753}
{"run":10,"commit":"dd38e1e","metric":0.9693620859707721,"metrics":{},"status":"discard","description":"Follow-up: Ettin-150m @ 1024 with title_head on the frozen snapshot, using batch 2 and grad accumulation 4 to fit 12GB. Calibration stayed strong (log_loss 0.3580, ROC AUC 0.9446), but AP 0.9694 still trailed the current Ettin-68m @1024 title_head best at 0.9745, so discard.","timestamp":1776467490158,"segment":0,"confidence":367.711789081697,"iterationTokens":1277}
{"run":11,"commit":"dd38e1e","metric":0.9683701269344338,"metrics":{},"status":"discard","description":"Follow-up: Ettin-68m @ 1536 with title_head to test whether even more leading context beats the 1024 winner. It fit easily, but AP fell to 0.9684 and log_loss worsened badly to 0.5239, so longer context beyond 1024 is hurting on this frozen split.","timestamp":1776467728764,"segment":0,"confidence":313.6737412026034,"iterationTokens":881}
{"run":12,"commit":"dd38e1e","metric":0.9670489298786619,"metrics":{},"status":"discard","description":"Follow-up: Ettin-68m @ 768 with title_head to see whether a smaller context preserves most of the win while reducing cost. It was much faster (129.9s) and slightly leaner (2.25 GB), but AP dropped to 0.9670, so the current winner still benefits from the full 1024 budget.","timestamp":1776467875533,"segment":0,"confidence":268.3452117864965,"iterationTokens":779}
{"run":13,"commit":"dd38e1e","metric":0.9717909505772582,"metrics":{},"status":"discard","description":"Confirmation rerun of the current Ettin-68m @ 1024 title_head winner on the same frozen split. It dropped from AP 0.97446 to 0.97179 with worse recall/log_loss, confirming that training noise is still large enough to blur sub-0.003 gains; discard the duplicate rerun and treat the current winner as provisional.","timestamp":1776468054149,"segment":0,"confidence":326.29306624396713,"iterationTokens":1052}
{"run":14,"commit":"dd38e1e","metric":0.973903998864537,"metrics":{},"status":"discard","description":"Tried a 75/25 head/tail split for Ettin-68m @ 1024 to see whether the full tail was consuming too much budget. It produced excellent calibration (log_loss 0.3345, best so far) and strong ROC AUC, but AP 0.97390 still landed just below the current title_head best at 0.97446, so discard for now and record it as a near-miss worth revisiting if we start a more replication-heavy campaign.","timestamp":1776468264419,"segment":0,"confidence":367.711789081697,"iterationTokens":4543}
{"run":15,"commit":"dd38e1e","metric":0.9714199535921613,"metrics":{},"status":"discard","description":"Follow-up: Ettin-68m @ 1024 title_head for 3 epochs to see whether the current best was undertrained. It improved log_loss to 0.3517 but AP slipped to 0.9714 and runtime rose to 214.6s, so 3 epochs is not a win on the primary metric.","timestamp":1776468498391,"segment":0,"confidence":372.5067792889756,"iterationTokens":1267}
{"run":16,"commit":"dd38e1e","metric":0.958912143419436,"metrics":{},"status":"discard","description":"Follow-up: Ettin-68m @ 1024 title_head for 1 epoch to probe the speed/quality frontier. It nearly halved runtime to 98.1s, but AP collapsed to 0.9589 with worse ROC AUC and recall, so the winner needs more than one epoch.","timestamp":1776468610594,"segment":0,"confidence":368.9722380895609,"iterationTokens":763}
{"run":17,"commit":"dd38e1e","metric":0.9449337195873345,"metrics":{},"status":"discard","description":"Hyperparameter follow-up: Ettin-68m @ 1024 title_head with a lower learning rate (1e-5). It underfit badly on the frozen snapshot: AP fell to 0.9449 with broad metric regressions at similar runtime/VRAM, so discard.","timestamp":1776468793925,"segment":0,"confidence":280.85652679939454,"iterationTokens":1334}
{"run":18,"commit":"dd38e1e","metric":0.9643148428001637,"metrics":{},"status":"discard","description":"Hyperparameter follow-up: Ettin-68m @ 1024 title_head with a higher learning rate (3e-5). It recovered from the 1e-5 underfit case but still missed the default-LR winner badly on AP and recall, so discard and keep the default 2e-5 setting.","timestamp":1776468966691,"segment":0,"confidence":211.9471367434369,"iterationTokens":797}
{"run":19,"commit":"dd38e1e","metric":0.9713993599296676,"metrics":{},"status":"discard","description":"Large-model follow-up: Ettin-400m @ 1024 with title_head on the frozen snapshot, batch 1 and grad accumulation 8 to fit 12GB. It trained successfully and stayed within 7.82 GB VRAM, but AP 0.9714 and log_loss 0.5667 both trailed the Ettin-68m @1024 title_head winner, so scale alone is not helping here.","timestamp":1776469884813,"segment":0,"confidence":280.85652679939454,"iterationTokens":678}
{"run":20,"commit":"dd38e1e","metric":0.958899559193092,"metrics":{},"status":"discard","description":"User-suggested model sweep: Ettin-32m @ 1024 with title_head on the frozen snapshot. Extremely efficient (1.19 GB VRAM, 103s total) but AP 0.9589 was well below the current Ettin-68m winner, so discard.","timestamp":1776470008478,"segment":0,"confidence":211.9471367434369,"iterationTokens":1263}
{"run":21,"commit":"dd38e1e","metric":0.9540512314337559,"metrics":{},"status":"discard","description":"User-suggested model sweep: Ettin-17m @ 1024 with title_head on the frozen snapshot. Tiny and very fast (0.90 GB VRAM, 70.6s), but AP 0.9541 and recall 0.744 were far below the current best, so discard.","timestamp":1776470096230,"segment":0,"confidence":200.77792596328564,"iterationTokens":734}
{"run":22,"commit":"dd38e1e","metric":0,"metrics":{},"status":"crash","description":"User-suggested model sweep: DeBERTa-v3-small @ 512 title_head crashed before training because the tokenizer requires protobuf, which is not currently installed in the uv environment.","timestamp":1776470115809,"segment":0,"confidence":200.77792596328564,"iterationTokens":741}
{"run":23,"commit":"dd38e1e","metric":0,"metrics":{},"status":"crash","description":"Retry of user-suggested DeBERTa-v3-small @ 512 title_head after installing protobuf still crashed in tokenizer conversion. The uv environment also needs sentencepiece support for this model family.","timestamp":1776470144917,"segment":0,"confidence":200.77792596328564,"iterationTokens":1217}
{"run":24,"commit":"dd38e1e","metric":0.9601690439186132,"metrics":{},"status":"discard","description":"User-suggested model sweep: DeBERTa-v3-small @ 512 with title_head on the frozen snapshot. It trained successfully after adding protobuf+sentencepiece support, but AP 0.9602 and recall 0.758 were comfortably below the Ettin-68m @1024 title_head winner, so discard.","timestamp":1776470302031,"segment":0,"confidence":189.0120719841904,"iterationTokens":1107}
{"run":25,"commit":"dd38e1e","metric":0.956059420972724,"metrics":{},"status":"discard","description":"User-suggested model sweep: DeBERTa-v3-base @ 512 with title_head on the frozen snapshot. It had strong threshold metrics and log_loss 0.3637, but AP 0.9561 was far below the current Ettin-68m @1024 title_head best, so discard.","timestamp":1776470533217,"segment":0,"confidence":179.89431802612467,"iterationTokens":763}
{"run":26,"commit":"dd38e1e","metric":0.970879019783363,"metrics":{},"status":"discard","description":"User-suggested model sweep: ModernBERT-large @ 512 with title_head on the frozen snapshot. It fit on 12GB (8.89 GB peak) and was solid overall, but AP 0.9709 still trailed the Ettin-68m @1024 title_head winner by a meaningful margin, so discard.","timestamp":1776470881870,"segment":0,"confidence":189.0120719841904,"iterationTokens":726}
{"run":27,"commit":"dd38e1e","metric":0,"metrics":{},"status":"crash","description":"User-suggested embedding baseline: google/embeddinggemma-300m @ 2048 with title_head and a logistic-regression linear head crashed immediately because the Hugging Face repo is gated and inaccessible from this environment.","timestamp":1776471003606,"segment":0,"confidence":189.0120719841904,"iterationTokens":5975}
{"run":28,"commit":"dd38e1e","metric":0,"metrics":{},"status":"crash","description":"Attempted BAAI/bge-m3 embedding+linear-head run, but the experiment-only helper script had been auto-reverted because it was not treated as a preserved autoresearch file. Need to inline the embedding path into autoresearch.sh before retrying embedding models.","timestamp":1776471013757,"segment":0,"confidence":189.0120719841904,"iterationTokens":588}
{"run":29,"commit":"dd38e1e","metric":0.9735184556697014,"metrics":{},"status":"discard","description":"User-suggested embedding baseline: BAAI/bge-m3 @ 2048 with title_head and a logistic-regression linear head on the frozen snapshot. This was surprisingly strong—AP 0.9735, ROC AUC 0.9455, log_loss 0.3534, only 2.37 GB VRAM—but it still fell just short of the current Ettin-68m @1024 title_head fine-tuned winner at 0.97446, so discard as a high-quality near miss.","timestamp":1776471494351,"segment":0,"confidence":200.77792596328564,"iterationTokens":3881}
