{"run":94,"commit":"689673c","metric":0.9790580566104216,"metrics":{},"status":"discard","description":"Required queue rerun 5/6 against the current EmbeddingGemma title_head C=5.0 control: Snowflake/snowflake-arctic-embed-m-v2.0 @ 2048, single_blob, embedding+linear head, full frozen train split, cls pooling, C=5.0, with memory-efficient attention disabled to avoid the remote-code xformers requirement. It ran cleanly and efficiently, but AP 0.979058 and log_loss 0.23199 were still well below the control, so discard.","timestamp":1776544877327,"segment":0,"confidence":165.47347060266256,"iterationTokens":941}
{"run":95,"commit":"689673c","metric":0.9719291512725778,"metrics":{},"status":"discard","description":"Required queue rerun 6/6 against the current EmbeddingGemma title_head C=5.0 control: mixedbread-ai/mxbai-embed-large-v1 @ 512, single_blob, embedding+linear head, full frozen train split, cls pooling, C=5.0. Efficient and respectable overall, but AP 0.971929 was far from the control, so discard.","timestamp":1776545102350,"segment":0,"confidence":164.08687518252532,"iterationTokens":869}
