{"run":30,"commit":"dd38e1e","metric":0.9729639943559171,"metrics":{},"status":"discard","description":"User-suggested embedding follow-up: BAAI/bge-m3 @ 4096 with title_head and a logistic-regression linear head. Extending context from 2048 to 4096 did not help: AP slipped to 0.9730 with slightly worse log_loss than the 2048 embedding run, so discard.","timestamp":1776471826159,"segment":0,"confidence":211.9471367434369,"iterationTokens":872}
{"run":31,"commit":"dd38e1e","metric":0.9736507276702752,"metrics":{},"status":"discard","description":"Embedding follow-up: BAAI/bge-m3 @ 2048 with single_blob and a logistic-regression linear head. This slightly improved over the title_head embedding variant and remained a near miss (AP 0.97365, ROC AUC 0.94545, log_loss 0.35383), but it still did not clear the current Ettin-68m @1024 title_head best on the primary metric and is a more complex/slower path, so discard for now.","timestamp":1776472203129,"segment":0,"confidence":263.2472921524523,"iterationTokens":854}
{"run":32,"commit":"dd38e1e","metric":0.9719463083034574,"metrics":{},"status":"discard","description":"Large-context follow-up: ModernBERT-large @ 1024 with title_head on the frozen snapshot, batch 1 with grad accumulation 8. It fit within 12GB and had strong secondary metrics plus log_loss 0.3488, but AP 0.97195 still trailed the current Ettin-68m winner, so discard.","timestamp":1776472836193,"segment":0,"confidence":318.2320959383146,"iterationTokens":1342}
{"run":33,"commit":"10e5ebb","metric":0.9747464944507551,"metrics":{},"status":"keep","description":"Embedding follow-up: BAAI/bge-m3 @ 2048 with single_blob and a logistic-regression linear head, increasing linear-head regularization strength to C=4.0. This finally beat the current fine-tuned Ettin winner on AP (0.97475 vs 0.97446) and also improved ROC AUC to 0.94806 plus best-so-far log_loss 0.32483, while staying at only 2.37 GB peak VRAM, so keep as the new best.","timestamp":1776473209780,"segment":0,"confidence":343.23149103468296,"iterationTokens":794}
{"run":34,"commit":"10e5ebb","metric":0.9747464944507551,"metrics":{},"status":"discard","description":"Confirmation rerun of the new BAAI/bge-m3 @ 2048 single_blob embedding+linear-head winner with C=4.0. It reproduced bit-for-bit identical metrics, confirming this path is deterministic and that the AP/log-loss improvement over the prior Ettin best is real; discard the duplicate rerun while keeping the earlier winning commit.","timestamp":1776473579171,"segment":0,"confidence":357.25565736151754,"iterationTokens":1155}
{"run":35,"commit":"10e5ebb","metric":0.9740170428580717,"metrics":{},"status":"discard","description":"Embedding follow-up: BAAI/bge-m3 @ 4096 with single_blob and logistic-regression head at C=4.0. Longer context stayed strong but did not beat the 2048 winner: AP slipped to 0.97402 and log_loss was slightly worse, so discard.","timestamp":1776473907650,"segment":0,"confidence":363.83595468540216,"iterationTokens":834}
{"run":36,"commit":"10e5ebb","metric":0.9745047796508329,"metrics":{},"status":"discard","description":"Embedding hyperparameter sweep: BAAI/bge-m3 @ 2048 single_blob with logistic-regression head at C=8.0. It remained extremely competitive and slightly improved recall, but AP 0.97450 still missed the kept C=4.0 best at 0.97475, so discard.","timestamp":1776474279526,"segment":0,"confidence":360.00708055137756,"iterationTokens":736}
{"run":37,"commit":"10e5ebb","metric":0.9744283571781873,"metrics":{},"status":"discard","description":"Embedding hyperparameter sweep: BAAI/bge-m3 @ 2048 single_blob with logistic-regression head at C=2.0. This was another near tie, but AP 0.97443 and log_loss 0.33443 were both worse than the kept C=4.0 configuration, so discard.","timestamp":1776474646707,"segment":0,"confidence":339.3526072614387,"iterationTokens":749}
{"run":38,"commit":"05fb4bc","metric":0.9747742596789588,"metrics":{},"status":"keep","description":"Embedding hyperparameter follow-up: BAAI/bge-m3 @ 2048 with title_head and logistic-regression head at C=4.0. This edged past the current best single_blob embedding run on AP (0.97477 vs 0.97475) while also slightly improving ROC AUC and log_loss, so keep as the new best frozen-snapshot configuration.","timestamp":1776475027836,"segment":0,"confidence":320.9395332543002,"iterationTokens":907}
{"run":39,"commit":"05fb4bc","metric":0.9746741176281307,"metrics":{},"status":"discard","description":"Embedding hyperparameter sweep: BAAI/bge-m3 @ 2048 title_head with logistic-regression head at C=6.0. It marginally improved log_loss to 0.3233, but AP dipped below the kept C=4.0 best (0.97467 vs 0.97477), so discard on the primary metric.","timestamp":1776475407314,"segment":0,"confidence":339.48400086083967,"iterationTokens":1142}
{"run":40,"commit":"6c2ca88","metric":0.9747704602090661,"metrics":{},"status":"keep","description":"Embedding hyperparameter sweep: BAAI/bge-m3 @ 2048 title_head with logistic-regression head at C=5.0. AP is an effective tie with the kept C=4.0 run (difference ~3.8e-06), but ROC AUC improved to 0.94856 and log_loss improved further to 0.32235 at identical complexity/VRAM, so keep on tiebreakers.","timestamp":1776475785501,"segment":0,"confidence":354.71852024325995,"iterationTokens":834}
{"run":41,"commit":"6c2ca88","metric":0.9747203896181503,"metrics":{},"status":"discard","description":"Embedding hyperparameter sweep: BAAI/bge-m3 @ 2048 title_head with logistic-regression head at C=4.5. It stayed in the same narrow optimum band, but AP and log_loss were both slightly worse than the kept C=5.0 run, so discard.","timestamp":1776476159976,"segment":0,"confidence":353.8072039044335,"iterationTokens":1069}
{"run":42,"commit":"6c2ca88","metric":0.9746728113789442,"metrics":{},"status":"discard","description":"Embedding hyperparameter sweep: BAAI/bge-m3 @ 2048 title_head with logistic-regression head at C=5.5. It kept the strong calibration regime but AP drifted down and still failed to improve on the kept C=5.0 setting, so discard.","timestamp":1776476534760,"segment":0,"confidence":353.06963040916077,"iterationTokens":760}
{"run":43,"commit":"4d914da","metric":0.9777876988657945,"metrics":{},"status":"keep","description":"Explicit class-balancing experiment on the current embedding winner: BAAI/bge-m3 @ 2048 title_head with logistic-regression head at C=5.0, but trained on the full frozen training snapshot instead of the production-style downsampled balanced subset. This delivered a clear step up in quality—AP 0.97779, ROC AUC 0.95711, log_loss 0.23191, accuracy 0.9266, recall 0.9748—while still using only 2.37 GB VRAM, so keep as the new best.","timestamp":1776477020880,"segment":0,"confidence":427.9590796218749,"iterationTokens":1449}
{"run":44,"commit":"21efd31","metric":0.9778471098826151,"metrics":{},"status":"keep","description":"Follow-up on the new full-training embedding regime: BAAI/bge-m3 @ 2048 with single_blob and logistic-regression head at C=5.0 on the full frozen training snapshot. This edged past the title_head full-data winner on AP (0.97785 vs 0.97779) and improved log_loss to 0.23054, so keep as the new best.","timestamp":1776477480648,"segment":0,"confidence":535.6753437252796,"iterationTokens":1107}
{"run":45,"commit":"c1a47b2","metric":0.978103593318632,"metrics":{},"status":"keep","description":"Embedding hyperparameter sweep in the full-training regime: BAAI/bge-m3 @ 2048 with single_blob and logistic-regression head at C=4.0. This improved the primary metric again to AP 0.97810 and also raised ROC AUC/recall/F1, so keep as the new best despite a small log_loss tradeoff versus C=5.0.","timestamp":1776477939464,"segment":0,"confidence":537.8555175017638,"iterationTokens":916}
{"run":46,"commit":"c1a47b2","metric":0.9779926928949471,"metrics":{},"status":"discard","description":"Embedding hyperparameter sweep in the full-training regime: BAAI/bge-m3 @ 2048 with single_blob and logistic-regression head at C=3.0. It stayed close, but AP and log_loss both moved the wrong way versus the kept C=4.0 best, so discard.","timestamp":1776478396709,"segment":0,"confidence":540.0535102125976,"iterationTokens":908}
{"run":47,"commit":"c1a47b2","metric":0.9778507453164992,"metrics":{},"status":"discard","description":"Embedding hyperparameter sweep in the full-training regime: BAAI/bge-m3 @ 2048 with single_blob and logistic-regression head at C=4.5. It improved log_loss and threshold metrics, but AP slipped below the kept C=4.0 run, so discard on the primary metric.","timestamp":1776478855003,"segment":0,"confidence":529.8577247250078,"iterationTokens":749}
{"run":48,"commit":"c1a47b2","metric":0.9778067018443386,"metrics":{},"status":"discard","description":"Long-context follow-up in the full-training embedding regime: BAAI/bge-m3 @ 4096 with single_blob and logistic-regression head at C=4.0. Extra context did not help once full training data was used: AP slipped to 0.97781 and log_loss worsened, so discard.","timestamp":1776479256348,"segment":0,"confidence":458.7297975420567,"iterationTokens":782}
{"run":49,"commit":"c1a47b2","metric":0.9777848780081766,"metrics":{},"status":"discard","description":"Full-training embedding cross-check: BAAI/bge-m3 @ 2048 with title_head and logistic-regression head at C=4.0. It remained strong but still landed just below the kept single_blob C=4.0 full-data best on AP and log_loss, so discard.","timestamp":1776479725093,"segment":0,"confidence":442.6088473523468,"iterationTokens":881}
{"run":50,"commit":"2d0f169","metric":0.9777899910543404,"metrics":{},"status":"keep","description":"Enabled full-training mode in the transformer harness and ran the first encoder full-data check: Ettin-68m @ 1024 title_head with the full frozen training set. It did not beat the current best embedding regime on AP (0.97779 vs 0.97810), but it validated that full-data encoder training is strong and keeps the new harness capability needed for further full-mode encoder exploration.","timestamp":1776503672957,"segment":0,"confidence":427.5824938807237,"iterationTokens":3283}
{"run":51,"commit":"2d0f169","metric":0,"metrics":{},"status":"crash","description":"Retried the requested EmbeddingGemma path after authenticating Hugging Face, but google/embeddinggemma-300m still returns 403 gated-repo authorization errors. The token is valid, but this account has not been granted access to the model yet.","timestamp":1776503694930,"segment":0,"confidence":427.5824938807237,"iterationTokens":1314}
{"run":52,"commit":"2d0f169","metric":0.9693855577984802,"metrics":{},"status":"discard","description":"Encoder full-data sweep: Ettin-150m @ 1024 title_head with the full frozen training set, batch 2 and grad accumulation 4. It fit cleanly and produced very strong recall/F1, but AP 0.96939 was far below both the best full-data Ettin-68m run and the current BGE embedding winner, so discard.","timestamp":1776504118720,"segment":0,"confidence":393.6553199019676,"iterationTokens":795}
{"run":54,"commit":"2d0f169","metric":0,"metrics":{},"status":"crash","description":"Encoder full-data sweep: DeBERTa-v3-base @ 512 title_head hit a local artifact-storage failure before training started (`No space left on device` under artifacts/relevance_autoresearch/runs). Freed disk by deleting old run directories so the loop can continue.","timestamp":1776505043536,"segment":0,"confidence":393.6553199019676,"iterationTokens":4008}
{"run":55,"commit":"2d0f169","metric":0.9608776329321947,"metrics":{},"status":"discard","description":"Encoder full-data sweep: DeBERTa-v3-base @ 512 title_head on the full frozen training set. Threshold metrics and recall were strong, but AP 0.96088 remained far below the current best BGE full-data embedding regime, so discard.","timestamp":1776505367726,"segment":0,"confidence":364.71635403389746,"iterationTokens":1033}
{"run":56,"commit":"2d0f169","metric":0.973905739545804,"metrics":{},"status":"discard","description":"Encoder full-data sweep: ModernBERT-base @ 1024 title_head on the full frozen training set. Full-data training helped a lot versus the balanced regime and gave strong calibration/recall, but AP 0.97391 still stayed below the best BGE full-data embedding setup at 0.97810, so discard.","timestamp":1776505772375,"segment":0,"confidence":393.6553199019676,"iterationTokens":758}
{"run":57,"commit":"a27d7c7","metric":0.9840544956495607,"metrics":{},"status":"keep","description":"Retried the authorized EmbeddingGemma path after license access was granted: google/embeddinggemma-300m @ 2048 with single_blob, embedding+logistic-regression head, and full frozen training data at C=4.0. It delivered a major jump to AP 0.98405 with ROC AUC 0.96794, log_loss 0.21510, and only 1.69 GB peak VRAM, clearly beating the previous BGE full-data best.","timestamp":1776508429295,"segment":0,"confidence":347.31128692064823,"iterationTokens":758}
{"run":58,"commit":"e3ceb1b","metric":0.9840544956495607,"metrics":{},"status":"discard","description":"Control rerun after the recent embedding-harness changes: EmbeddingGemma-300m @ 2048 single_blob, embedding+linear head, full frozen train split, C=4.0. It reproduced the kept control bit-for-bit, confirming the harness is stable; discard this duplicate rerun while keeping the existing control commit.","timestamp":1776511081188,"segment":0,"confidence":278.79096321806077,"iterationTokens":10112}
{"run":59,"commit":"a27d7c7","metric":0.9832518226978473,"metrics":{},"status":"discard","description":"Required queue run 2: Alibaba-NLP/gte-base-en-v1.5 @ 2048 single_blob, embedding+linear head, full frozen train split, cls pooling. Very strong and efficient (0.81 GB VRAM), but AP 0.98325 remained below the EmbeddingGemma control at 0.98405, so discard.","timestamp":1776511289706,"segment":0,"confidence":248.04828945762827,"iterationTokens":841}
{"run":60,"commit":"a27d7c7","metric":0.9829734168425353,"metrics":{},"status":"discard","description":"Required queue run 3: Alibaba-NLP/gte-large-en-v1.5 @ 2048 single_blob, embedding+linear head, full frozen train split, cls pooling. It had excellent secondary metrics and low log_loss 0.2123, but AP 0.98297 still trailed the EmbeddingGemma control, so discard.","timestamp":1776511833615,"segment":0,"confidence":248.01377426097164,"iterationTokens":793}
{"run":61,"commit":"a27d7c7","metric":0,"metrics":{},"status":"crash","description":"Required queue run 4: nomic-ai/nomic-embed-text-v1.5 @ 2048 single_blob with the model-card knobs (mean pooling, classification prefix, layer norm, dim truncation to 512) crashed before loading because the dynamic model requires einops, which is not yet installed in the uv environment.","timestamp":1776511851323,"segment":0,"confidence":248.01377426097164,"iterationTokens":787}
{"run":62,"commit":"a27d7c7","metric":0.9800671234306589,"metrics":{},"status":"discard","description":"Required queue run 4 retry: nomic-ai/nomic-embed-text-v1.5 @ 2048 single_blob with the model-card knobs (mean pooling, `classification: ` prefix, layer norm on, dim truncation to 512) on the full frozen train split. Very strong and extremely lightweight (0.79 GB VRAM), but AP 0.98007 still trailed the EmbeddingGemma control, so discard.","timestamp":1776512067282,"segment":0,"confidence":247.9792686683567,"iterationTokens":825}
{"run":63,"commit":"a27d7c7","metric":0,"metrics":{},"status":"crash","description":"Required queue run 5: Snowflake/snowflake-arctic-embed-m-v2.0 @ 2048 single_blob, embedding+linear head, full frozen train split, cls pooling, crashed at model load because the model implementation asserts that xformers is installed.","timestamp":1776512096685,"segment":0,"confidence":247.9792686683567,"iterationTokens":823}
{"run":64,"commit":"a27d7c7","metric":0.9794656233744887,"metrics":{},"status":"discard","description":"Required queue run 5 retry: Snowflake/snowflake-arctic-embed-m-v2.0 @ 2048 single_blob, embedding+linear head, full frozen train split, cls pooling. After installing xformers it ran cleanly and was efficient, but AP 0.97947 still stayed below the EmbeddingGemma control, so discard.","timestamp":1776512302238,"segment":0,"confidence":250.281026490026,"iterationTokens":1654}
{"run":65,"commit":"a27d7c7","metric":0.9726680947366222,"metrics":{},"status":"discard","description":"Required queue run 6: mixedbread-ai/mxbai-embed-large-v1 @ 512 single_blob, embedding+linear head, full frozen train split, cls pooling. It was solid and efficient, but AP 0.97267 was not competitive with the EmbeddingGemma control, so discard.","timestamp":1776512540334,"segment":0,"confidence":247.9792686683567,"iterationTokens":786}
{"run":66,"commit":"a2f031c","metric":0.9840963101319444,"metrics":{},"status":"keep","description":"Post-queue follow-up on the current winner: EmbeddingGemma-300m @ 2048 with title_head, embedding+linear head, full frozen train split, mean pooling, C=4.0. This edged past the single_blob control on AP (0.984096 vs 0.984054) and also improved ROC AUC/log_loss slightly at the same complexity and VRAM, so keep as the new best.","timestamp":1776512843594,"segment":0,"confidence":250.281026490026,"iterationTokens":971}
{"run":67,"commit":"ea778e6","metric":0.984098480367228,"metrics":{},"status":"keep","description":"Hyperparameter follow-up on the new EmbeddingGemma title_head winner: raised the logistic-regression head strength to C=5.0. AP improved by a tiny amount (0.984098 vs 0.984096) and the secondary metrics improved more clearly, especially log_loss (0.21130) plus accuracy/precision/F1, so keep as the new best on tiebreakers.","timestamp":1776513141131,"segment":0,"confidence":252.62591474761803,"iterationTokens":916}
{"run":68,"commit":"ea778e6","metric":0.9839265965202649,"metrics":{},"status":"discard","description":"Hyperparameter follow-up on EmbeddingGemma title_head full-data: increased the logistic-regression head to C=6.0. This slightly improved log_loss again, but AP slipped below the kept C=5.0 winner, so discard on the primary metric.","timestamp":1776513453179,"segment":0,"confidence":253.32054832568826,"iterationTokens":898}
{"run":88,"commit":"2fd98a7","metric":0.9840420808149517,"metrics":{},"status":"discard","description":"Control rerun using the current EmbeddingGemma title_head full-data winner: google/embeddinggemma-300m @ 2048, embedding+linear head, C=5.0, mean pooling. It reproduced the kept control very closely (AP 0.984042 vs 0.984098; roc_auc 0.96814; log_loss 0.21102) but landed slightly below the current best, so discard this duplicate rerun and proceed to the required queue models in order.","timestamp":1776542642763,"segment":0,"confidence":184.8211735619178,"iterationTokens":898}
{"run":89,"commit":"2fd98a7","metric":0.9830456828495484,"metrics":{},"status":"discard","description":"Required queue rerun 2/6 against the current EmbeddingGemma title_head C=5.0 control: Alibaba-NLP/gte-base-en-v1.5 @ 2048, single_blob, embedding+linear head, full frozen train split, cls pooling, C=5.0. Strong and efficient (AP 0.983046, roc_auc 0.96283, log_loss 0.22228, 1.07 GB VRAM) but still below the control, so discard.","timestamp":1776542887418,"segment":0,"confidence":187.82717337858543,"iterationTokens":910}
{"run":90,"commit":"2fd98a7","metric":0.9831109105611744,"metrics":{},"status":"discard","description":"Required queue rerun 3/6 against the current EmbeddingGemma title_head C=5.0 control: Alibaba-NLP/gte-large-en-v1.5 @ 2048, single_blob, embedding+linear head, full frozen train split, cls pooling, C=5.0. Excellent secondary metrics and log_loss 0.21068, but AP 0.983111 still did not clear the control and runtime was much higher, so discard.","timestamp":1776543591002,"segment":0,"confidence":190.93257122360978,"iterationTokens":804}
{"run":91,"commit":"2fd98a7","metric":0.979850936959918,"metrics":{},"status":"discard","description":"Required queue rerun 4/6 against the current EmbeddingGemma title_head C=5.0 control: nomic-ai/nomic-embed-text-v1.5 @ 2048, single_blob, embedding+linear head, full frozen train split, mean pooling with classification prefix, layer norm on, truncate dim 512, C=5.0. Very lightweight and solid overall, but AP 0.979851 and log_loss 0.22849 remained clearly behind the control, so discard.","timestamp":1776543845641,"segment":0,"confidence":178.27251431609034,"iterationTokens":799}
{"run":92,"commit":"ff113f9","metric":0.9840420808149517,"metrics":{},"status":"keep","description":"Added an embedding-harness knob for attn_implementation so model families that insist on xformers can be forced onto eager attention without changing benchmark semantics. Control rerun of google/embeddinggemma-300m @ 2048 title_head, full frozen train split, C=5.0 reproduced the current winner closely (AP 0.984042 vs 0.984098; roc_auc 0.96814; log_loss 0.21102), so keep this infrastructure change to continue the required queue.","timestamp":1776544269678,"segment":0,"confidence":166.77417066192342,"iterationTokens":3480}
{"run":93,"commit":"689673c","metric":0.9840420808149517,"metrics":{},"status":"keep","description":"Extended the embedding harness with a config override to disable custom memory-efficient attention on remote-code embedding models that otherwise hard-require xformers. Control rerun of google/embeddinggemma-300m @ 2048 title_head, full frozen train split, C=5.0 remained stable (AP 0.984042; roc_auc 0.96814; log_loss 0.21102), so keep this harness compatibility change for the remaining required-queue models.","timestamp":1776544672891,"segment":0,"confidence":159.1065120520002,"iterationTokens":410}
