{"run":28,"commit":"52aef73","metric":0.08984338,"metrics":{"macro_f1":0.2515873,"weighted_kappa":0.37681937,"log_duration_mae":0.86213586,"evergreen_auc":0.92867036,"mean_confidence":0.64967885},"status":"discard","description":"Five-fold sigmoid calibration for each ordinal boundary","timestamp":1785098075306,"segment":0,"confidence":49.98286032276013,"asi":{"hypothesis":"Training-only cross-validated sigmoid calibration may improve cumulative boundary probabilities.","learning":"Calibration improves evergreen AUC but worsens RPS, kappa, and MAE; fold-level fitting loses more semantic signal than the sigmoid correction recovers.","rollback_reason":"Primary RPS regressed from 0.08881373 to 0.08984338 and model complexity increased substantially.","next_action_hint":"Keep the direct probability outputs; use remaining runs for a tiny coefficient refinement or validation repeat."}}
{"run":29,"commit":"52aef73","metric":0.08880413,"metrics":{"macro_f1":0.29284085,"weighted_kappa":0.49358342,"log_duration_mae":0.85308064,"evergreen_auc":0.92451524,"mean_confidence":0.64049358},"status":"discard","description":"Refine fractional class-balance exponent from 0.375 to 0.35","timestamp":1785098103515,"segment":0,"confidence":49.378714175762944,"asi":{"hypothesis":"Quadratic interpolation of tested exponents suggests the local RPS optimum is near 0.35.","learning":"The measured gain is only 0.0000096 with unchanged hard metrics, far below a meaningful effect and likely benchmark-specific; retaining the interpretable three-eighths setting better avoids test-set overfitting.","rollback_reason":"Discarded despite nominal primary improvement because it is negligible, test-tuned, and below the prompt's 0.001 equivalence threshold.","next_action_hint":"Use the final run to confirm the retained best deterministically rather than tuning another decimal."}}
{"run":30,"commit":"52aef73","metric":0.08881373,"metrics":{"macro_f1":0.29284085,"weighted_kappa":0.49358342,"log_duration_mae":0.85430795,"evergreen_auc":0.92416898,"mean_confidence":0.63846897},"status":"discard","description":"Determinism check of retained ordinal embedding model","timestamp":1785098117839,"segment":0,"confidence":48.512850121340016,"asi":{"hypothesis":"The retained model and fixed harness should reproduce bit-for-bit before ending the initial segment.","learning":"All six metrics exactly match experiment 19, confirming deterministic training, prediction, and evaluation.","rollback_reason":"No code change and no primary improvement; logged as a validation run only.","next_action_hint":"Review the retained model on a new frozen temporal holdout or human-audited labels before further hyperparameter tuning."}}
{"type":"config","name":"Intrinsic semantic freshness — structural models","metricName":"rps","metricUnit":"","bestDirection":"lower"}
{"run":31,"commit":"c04ba9a","metric":0.08881373,"metrics":{"macro_f1":0.29284085,"weighted_kappa":0.49358342,"log_duration_mae":0.85430795,"evergreen_auc":0.92416898,"mean_confidence":0.63846897},"status":"keep","description":"Retained ordinal embedding model as structural-search baseline","timestamp":1785102593502,"segment":1,"confidence":null,"asi":{"hypothesis":"The best deterministic model from the first segment is the correct baseline for a new structural-model segment.","learning":"The retained model reproduces all prior metrics exactly; this segment will avoid fine-grained test-tuned hyperparameters and only compare materially different formulations."}}
{"run":32,"commit":"c04ba9a","metric":0.0893971,"metrics":{"macro_f1":0.31544107,"weighted_kappa":0.5092737,"log_duration_mae":0.85783316,"evergreen_auc":0.93282548,"mean_confidence":0.62589357},"status":"discard","description":"Append one-hot feed identity to ordinal embedding features","timestamp":1785102615657,"segment":1,"confidence":null,"asi":{"hypothesis":"Feed identity may encode a stable source-level lifetime prior that complements article semantics.","learning":"Feed identity improves macro F1, kappa, and evergreen AUC but slightly worsens RPS and duration MAE; source priors do not improve overall ordered calibration and risk source-specific overfitting.","rollback_reason":"Primary RPS regressed from 0.08881373 to 0.08939710.","next_action_hint":"Avoid source identity; test source-agnostic two-stage or non-linear semantic formulations."}}
{"run":33,"commit":"c04ba9a","metric":0.08812823,"metrics":{"macro_f1":0.25017718,"weighted_kappa":0.40660434,"log_duration_mae":0.84405434,"evergreen_auc":0.92416898,"mean_confidence":0.64339061},"status":"discard","description":"Two-stage evergreen then conditional mutable-horizon classification","timestamp":1785102644456,"segment":1,"confidence":null,"asi":{"hypothesis":"Separating evergreen detection from mutable-horizon prediction may prevent evergreen rows from distorting short-horizon boundaries.","learning":"Two-stage training nominally lowers RPS by 0.00069 and MAE, but materially worsens macro F1 and kappa while nearly doubling code; the gain is below the prompt's 0.001 equivalence threshold.","rollback_reason":"Prefer the simpler one-stage ordinal model for a sub-threshold gain and avoid fitting architecture to one frozen test split.","next_action_hint":"Explore genuinely different low-complexity geometry such as kernel approximation or nearest neighbors."}}
{"run":34,"commit":"c04ba9a","metric":0.10568261,"metrics":{"macro_f1":0.22496662,"weighted_kappa":0.20956454,"log_duration_mae":0.96127706,"evergreen_auc":0.88157895,"mean_confidence":0.57992221},"status":"discard","description":"Cosine 25-nearest-neighbor horizon probabilities","timestamp":1785102664745,"segment":1,"confidence":null,"asi":{"hypothesis":"Semantically nearby articles may share lifetime even when the relationship is not linearly separable.","learning":"Local cosine neighborhoods generalize poorly across the temporal split and trail linear embeddings on every metric; article lifetime is a broad semantic direction, not local story similarity.","rollback_reason":"Primary RPS regressed from 0.08881373 to 0.10568261.","next_action_hint":"Skip neighbor-count tuning; test a compact non-linear kernel model or class centroids only if it remains simple."}}
{"run":35,"commit":"c04ba9a","metric":0.09391264,"metrics":{"macro_f1":0.22812373,"weighted_kappa":0.35061797,"log_duration_mae":0.86065125,"evergreen_auc":0.90131579,"mean_confidence":0.66799609},"status":"discard","description":"RBF support-vector classifiers at ordinal boundaries","timestamp":1785102694984,"segment":1,"confidence":null,"asi":{"hypothesis":"A smooth non-linear boundary may capture interactions among semantic embedding dimensions missed by logistic regression.","learning":"RBF boundaries worsen RPS and all classification metrics; with 266 temporal training rows the extra flexibility does not generalize.","rollback_reason":"Primary RPS regressed from 0.08881373 to 0.09391264.","next_action_hint":"Do not tune kernels on this test set; return to linear models and seek target/feature formulations."}}
{"run":36,"commit":"c04ba9a","metric":0.1199826,"metrics":{"macro_f1":0.17829126,"weighted_kappa":0.17985612,"log_duration_mae":1.05276298,"evergreen_auc":0.72454986,"mean_confidence":0.64400021},"status":"discard","description":"Ordinal word TF-IDF classifiers over titles only","timestamp":1785102723183,"segment":1,"confidence":null,"asi":{"hypothesis":"Titles may concentrate deadlines and event state while avoiding evergreen background text in article bodies.","learning":"Title vocabulary alone is far too sparse and temporally unstable; it performs worse than body-inclusive TF-IDF and dense embeddings on every metric.","rollback_reason":"Primary RPS regressed to 0.11998260.","next_action_hint":"Do not add title-only ensembles; dense semantics remain essential."}}
{"run":37,"commit":"c04ba9a","metric":0.09695716,"metrics":{"macro_f1":0.22663535,"weighted_kappa":0.43443089,"log_duration_mae":0.88460831,"evergreen_auc":0.88054017,"mean_confidence":0.63984547},"status":"discard","description":"Ten-component partial least squares on cumulative targets","timestamp":1785102747679,"segment":1,"confidence":null,"asi":{"hypothesis":"Supervised low-rank projection may isolate a few semantic lifetime directions and reduce high-dimensional variance.","learning":"PLS loses evergreen discrimination and worsens RPS; useful lifetime information is distributed beyond ten supervised components or is better regularized by logistic loss.","rollback_reason":"Primary RPS regressed from 0.08881373 to 0.09695716.","next_action_hint":"Do not tune PLS component counts on the fixed test set; investigate training-only model selection or bagging."}}
{"run":38,"commit":"c04ba9a","metric":0.0889474,"metrics":{"macro_f1":0.24475806,"weighted_kappa":0.35692308,"log_duration_mae":0.85229124,"evergreen_auc":0.92590028,"mean_confidence":0.63296513},"status":"discard","description":"Twenty-model bootstrap bagging at each ordinal boundary","timestamp":1785102778735,"segment":1,"confidence":null,"asi":{"hypothesis":"Bootstrap averaging may reduce variance from the small temporal training set without changing the linear semantic model.","learning":"Bagging slightly improves MAE and evergreen AUC but marginally worsens RPS and sharply lowers hard-label quality; full-data fitting is more valuable than variance reduction here.","rollback_reason":"Primary RPS increased and 100 fitted models add unjustified complexity for a near tie.","next_action_hint":"Keep one full-data model; consider training-only validation to choose boundary-specific regularization rather than test-wide constants."}}
{"run":39,"commit":"c04ba9a","metric":0.09034071,"metrics":{"macro_f1":0.29086345,"weighted_kappa":0.46246973,"log_duration_mae":0.89398592,"evergreen_auc":0.92797784,"mean_confidence":0.59327467},"status":"discard","description":"Select boundary C values on newest training quarter","timestamp":1785102818333,"segment":1,"confidence":null,"asi":{"hypothesis":"A chronological validation slice within training can choose regularization without tuning against frozen test labels.","learning":"Training-only selection chose C=[10,3,3,10,10], but these stronger penalties underfit the later test period and worsen RPS/MAE; the tiny validation slice is too noisy for per-boundary selection.","rollback_reason":"Primary RPS regressed from 0.08881373 to 0.09034071 and code complexity rose sharply.","next_action_hint":"Retain one global regularization value; try label smoothing or adjacent-class targets derived entirely from training labels."}}
{"run":40,"commit":"c04ba9a","metric":0.0904046,"metrics":{"macro_f1":0.23232323,"weighted_kappa":0.4700156,"log_duration_mae":0.81905752,"evergreen_auc":0.91620499,"mean_confidence":0.71024038},"status":"discard","description":"Mean-center embeddings before L2 normalization","timestamp":1785102850604,"segment":1,"confidence":null,"asi":{"hypothesis":"Removing the dominant mean embedding direction may expose semantic lifetime geometry hidden by anisotropy.","learning":"Centering gives the best duration MAE seen among linear models but produces sharper, worse-calibrated probabilities and lower AUC; it may offer complementary expected-duration signal.","rollback_reason":"Primary RPS regressed from 0.08881373 to 0.09040460.","next_action_hint":"Test one conservative blend of centered and uncentered ordinal probabilities, then stop if RPS does not improve materially."}}
{"run":41,"commit":"c04ba9a","metric":0.08875739,"metrics":{"macro_f1":0.29346007,"weighted_kappa":0.50901655,"log_duration_mae":0.84707004,"evergreen_auc":0.92174515,"mean_confidence":0.65079095},"status":"discard","description":"Blend 20% mean-centered ordinal probabilities","timestamp":1785102881695,"segment":1,"confidence":null,"asi":{"hypothesis":"A small centered-embedding component may add complementary duration structure without dominating calibration.","learning":"The blend nominally improves RPS by only 0.000056 plus kappa/MAE, but lowers evergreen AUC and doubles model fits; the primary gain is far below the 0.001 simplicity threshold.","rollback_reason":"Discarded a negligible benchmark-specific gain to preserve the simpler one-representation model and avoid blend-weight tuning.","next_action_hint":"Do not tune the blend weight; investigate removing common principal components using training-only geometry only if it can stay simple."}}
{"run":42,"commit":"c04ba9a","metric":0.10748681,"metrics":{"macro_f1":0.20567533,"weighted_kappa":0.19476515,"log_duration_mae":0.97690959,"evergreen_auc":0.82479224,"mean_confidence":0.68403448},"status":"discard","description":"Center embeddings and remove their top principal component","timestamp":1785102905732,"segment":1,"confidence":null,"asi":{"hypothesis":"The common top embedding direction may be corpus noise that obscures semantic lifetime.","learning":"The leading centered component carries essential freshness information: removing it sharply degrades every metric, especially evergreen AUC.","rollback_reason":"Primary RPS regressed from 0.08881373 to 0.10748681.","next_action_hint":"Preserve the full embedding geometry; do not remove additional components."}}
{"run":43,"commit":"c04ba9a","metric":0.10565998,"metrics":{"macro_f1":0.26441627,"weighted_kappa":0.40625,"log_duration_mae":0.97864163,"evergreen_auc":0.91308864,"mean_confidence":0.41777969},"status":"discard","description":"Ridge regression to one latent horizon with Gaussian class spread","timestamp":1785102936255,"segment":1,"confidence":null,"asi":{"hypothesis":"A single continuous lifetime direction may generalize better than five independently fitted boundaries.","learning":"The proportional one-score assumption underfits the class-specific semantic boundaries and produces excessively diffuse distributions; RPS and MAE regress.","rollback_reason":"Primary RPS regressed from 0.08881373 to 0.10565998.","next_action_hint":"Keep independent cumulative boundaries; inspect alternative linear losses rather than collapsing to one score."}}
{"run":44,"commit":"c04ba9a","metric":0.09610345,"metrics":{"macro_f1":0.25173752,"weighted_kappa":0.49792255,"log_duration_mae":0.91366263,"evergreen_auc":0.90443213,"mean_confidence":0.67868655},"status":"discard","description":"L1-sparse logistic models at ordinal boundaries","timestamp":1785102954525,"segment":1,"confidence":null,"asi":{"hypothesis":"Sparse coefficients may select a compact set of embedding dimensions that generalizes across time.","learning":"L1 sparsity damages probability calibration, MAE, and evergreen discrimination; freshness information is distributed across embedding dimensions rather than axis-aligned.","rollback_reason":"Primary RPS regressed from 0.08881373 to 0.09610345.","next_action_hint":"Do not tune sparse penalties; retain dense L2 weights."}}
{"run":45,"commit":"c04ba9a","metric":0.08895076,"metrics":{"macro_f1":0.27871148,"weighted_kappa":0.55770415,"log_duration_mae":0.85233702,"evergreen_auc":0.91655125,"mean_confidence":0.63933283},"status":"discard","description":"Append parsed duration and explicit-date features to embeddings","timestamp":1785103015981,"segment":1,"confidence":null,"asi":{"hypothesis":"Numeric durations and explicit dates interpreted relative to publication can add concrete lifetime evidence beyond dense semantics.","learning":"Parsed temporal features substantially improve weighted kappa but slightly worsen RPS and evergreen AUC; they sharpen ordinal decisions without improving probability calibration.","rollback_reason":"Primary RPS regressed and 80+ lines of parsing complexity are unjustified for a near tie under the 0.001 simplicity rule.","next_action_hint":"Do not tune feature weights on the test set; preserve this as evidence that explicit dates may matter in a larger human-labeled corpus."}}
{"run":46,"commit":"c04ba9a","metric":0.10755668,"metrics":{"macro_f1":0.23347398,"weighted_kappa":0.25931975,"log_duration_mae":1.06183444,"evergreen_auc":0.90477839,"mean_confidence":0.41619172},"status":"discard","description":"Balanced ExtraTrees classifier over embeddings","timestamp":1785103043153,"segment":1,"confidence":null,"asi":{"hypothesis":"Randomized trees may recover non-linear semantic interactions without kernel tuning.","learning":"Axis-aligned trees underfit dense distributed embeddings and produce diffuse, poorly ordered probabilities; all metrics regress.","rollback_reason":"Primary RPS regressed from 0.08881373 to 0.10755668.","next_action_hint":"Do not tune tree ensembles on dense embeddings."}}
{"run":47,"commit":"ab97fcb","metric":0.0879238,"metrics":{"macro_f1":0.29284085,"weighted_kappa":0.49358342,"log_duration_mae":0.84456758,"evergreen_auc":0.92416898,"mean_confidence":0.643554},"status":"keep","description":"Project crossing ordinal probabilities with isotonic regression","timestamp":1785103076451,"segment":1,"confidence":0.3587270235407914,"asi":{"hypothesis":"Least-squares isotonic projection should repair crossing boundary probabilities more faithfully than asymmetrically clipping every later tail downward.","learning":"Proper PAVA projection lowers RPS by 0.00089 and MAE with identical hard predictions and AUC; it directly matches the ordered squared-error objective and adds only one standard sklearn operation."}}
{"run":48,"commit":"ab97fcb","metric":0.0879238,"metrics":{"macro_f1":0.29284085,"weighted_kappa":0.49358342,"log_duration_mae":0.84456758,"evergreen_auc":0.92416898,"mean_confidence":0.643554},"status":"discard","description":"Determinism check for isotonic ordinal projection","timestamp":1785103091139,"segment":1,"confidence":0.3634065716426645,"asi":{"hypothesis":"The retained isotonic improvement should reproduce exactly despite the dashboard's cross-experiment noise estimate.","learning":"All metrics reproduce bit-for-bit; the 0.00089 gain is deterministic, though external-holdout significance still requires new labels.","rollback_reason":"No code change or additional primary improvement; validation run only.","next_action_hint":"Continue with non-test-tuned probability constraints or training-only targets."}}
{"run":49,"commit":"ab97fcb","metric":0.08798722,"metrics":{"macro_f1":0.29284085,"weighted_kappa":0.49358342,"log_duration_mae":0.84258037,"evergreen_auc":0.92416898,"mean_confidence":0.64565966},"status":"discard","description":"Normalize fractional class weights to unit mean per boundary","timestamp":1785103123786,"segment":1,"confidence":0.3682098216317505,"asi":{"hypothesis":"Unit-mean class weights should keep C's effective regularization comparable across differently imbalanced boundaries.","learning":"Weight normalization slightly improves duration MAE but marginally worsens RPS with identical hard predictions; the original implicit per-boundary regularization is better calibrated.","rollback_reason":"Primary RPS increased and added bookkeeping for a negligible tradeoff.","next_action_hint":"Keep the original fractional weights; avoid further decimal-scale weighting changes."}}
{"run":50,"commit":"ab97fcb","metric":0.08824975,"metrics":{"macro_f1":0.29181121,"weighted_kappa":0.48464251,"log_duration_mae":0.84534556,"evergreen_auc":0.92451524,"mean_confidence":0.64328801},"status":"discard","description":"Blend 20% multinomial probabilities into ordinal predictions","timestamp":1785103152033,"segment":1,"confidence":0.4651052187342383,"asi":{"hypothesis":"A multinomial classifier may add mutually exclusive class evidence missing from independently fitted ordinal boundaries.","learning":"The multinomial component slightly improves evergreen AUC but worsens RPS, MAE, macro F1, and kappa; its errors are not complementary enough.","rollback_reason":"Primary RPS regressed and an extra model adds complexity.","next_action_hint":"Do not tune multinomial blend weights; the isotonic ordinal model remains stronger alone."}}
{"run":51,"commit":"ab97fcb","metric":0.09819334,"metrics":{"macro_f1":0.23040022,"weighted_kappa":0.24908325,"log_duration_mae":0.92329388,"evergreen_auc":0.88227147,"mean_confidence":0.63005663},"status":"discard","description":"Character TF-IDF ordinal classifiers over title and body","timestamp":1785103185708,"segment":1,"confidence":0.3682098216317505,"asi":{"hypothesis":"Character n-grams may capture multilingual temporal morphology, dates, and recurring phrases more robustly than word TF-IDF.","learning":"Character text features improve over title-only words but remain far behind dense embeddings on every metric; surface patterns do not generalize enough across time.","rollback_reason":"Primary RPS regressed from 0.08792380 to 0.09819334.","next_action_hint":"Stop text-only variants; semantic embeddings are decisively better."}}
{"run":52,"commit":"ab97fcb","metric":0.11626126,"metrics":{"macro_f1":0.10578842,"weighted_kappa":0,"log_duration_mae":0.97903432,"evergreen_auc":0.90927978,"mean_confidence":0.53135846},"status":"discard","description":"Class-prior-adjusted cosine similarity to horizon centroids","timestamp":1785103227289,"segment":1,"confidence":0.3634065716426645,"asi":{"hypothesis":"One semantic centroid per horizon may provide a stable low-variance alternative for rare classes.","learning":"Horizon classes are not compact cosine clusters; centroid probabilities collapse hard ordering and severely regress RPS despite retaining some evergreen ranking.","rollback_reason":"Primary RPS regressed from 0.08792380 to 0.11626126.","next_action_hint":"Close the centroid/nearest-neighbor hypothesis; discriminative linear boundaries are necessary."}}
