{"type":"config","name":"Intrinsic semantic freshness","metricName":"rps","metricUnit":"","bestDirection":"lower"}
{"run":1,"commit":"b4a34c7","metric":0.21905157,"metrics":{"macro_f1":0.04032588,"weighted_kappa":0.27848101,"log_duration_mae":1.90845317,"evergreen_auc":0.86963296,"mean_confidence":0.41802788},"status":"keep","description":"Baseline: map current urgency probability monotonically across six horizons","timestamp":1785097419827,"segment":0,"confidence":null,"asi":{"hypothesis":"The production urgency score may provide a weak ordered-horizon baseline when mapped monotonically into six classes.","learning":"Urgency separates evergreen articles well (AUC 0.87) but collapses argmax predictions and gives very poor macro F1, leaving substantial room for an article-content model."}}
{"run":2,"commit":"4c7a611","metric":0.10507597,"metrics":{"macro_f1":0.23113811,"weighted_kappa":0.21999551,"log_duration_mae":0.95485378,"evergreen_auc":0.91447368,"mean_confidence":0.54002143},"status":"keep","description":"Multinomial logistic regression over normalized EmbeddingGemma vectors","timestamp":1785097444136,"segment":0,"confidence":null,"asi":{"hypothesis":"EmbeddingGemma vectors encode semantic lifetime cues that a regularized multinomial linear classifier can recover.","learning":"Embedding-only logistic regression halves RPS versus urgency mapping and improves all probability-sensitive metrics; direct semantic representation is a strong baseline despite modest hard-label kappa."}}
{"run":3,"commit":"4c7a611","metric":0.11420269,"metrics":{"macro_f1":0.16752688,"weighted_kappa":0.0993014,"log_duration_mae":0.98745395,"evergreen_auc":0.90962604,"mean_confidence":0.50354598},"status":"discard","description":"Increase multinomial embedding regularization with C=0.3","timestamp":1785097458232,"segment":0,"confidence":12.48812278671857,"asi":{"hypothesis":"Stronger regularization may smooth overconfident class probabilities and lower RPS on the temporal test split.","learning":"C=0.3 underfits the embedding signal: RPS, macro F1, kappa, and MAE all worsen versus C=1.0.","rollback_reason":"Primary RPS regressed from 0.10507597 to 0.11420269.","next_action_hint":"Try moderately weaker regularization or a structurally different ordinal/text model."}}
{"run":4,"commit":"9a34960","metric":0.0969602,"metrics":{"macro_f1":0.24317447,"weighted_kappa":0.25262238,"log_duration_mae":0.90676853,"evergreen_auc":0.91655125,"mean_confidence":0.59296086},"status":"keep","description":"Reduce embedding logistic regularization with C=3","timestamp":1785097472421,"segment":0,"confidence":14.161686624147663,"asi":{"hypothesis":"The small training set still benefits from a less constrained embedding decision surface because pretrained vectors already carry strong semantic structure.","learning":"C=3 improves RPS by 0.0081 over C=1 and also improves every secondary metric, indicating the C=1 model was underfitting rather than overconfident."}}
{"run":5,"commit":"82d8523","metric":0.09263039,"metrics":{"macro_f1":0.23779149,"weighted_kappa":0.3464043,"log_duration_mae":0.85339358,"evergreen_auc":0.91204986,"mean_confidence":0.65653606},"status":"keep","description":"Further reduce embedding logistic regularization with C=10","timestamp":1785097488686,"segment":0,"confidence":13.851764927597221,"asi":{"hypothesis":"A still weaker L2 penalty may recover finer semantic horizon distinctions without unacceptable probability overconfidence.","learning":"C=10 improves RPS, kappa, and duration MAE; evergreen AUC and macro F1 dip slightly, but the ordered probability quality improves clearly."}}
{"run":6,"commit":"82d8523","metric":0.09395122,"metrics":{"macro_f1":0.23015285,"weighted_kappa":0.33161733,"log_duration_mae":0.82232077,"evergreen_auc":0.90685596,"mean_confidence":0.71364769},"status":"discard","description":"Test weak embedding logistic regularization with C=30","timestamp":1785097504029,"segment":0,"confidence":16.36037260200225,"asi":{"hypothesis":"C=30 may continue the C=1 to C=10 improvement trend by sharpening semantic class boundaries.","learning":"The RPS optimum is below C=30: confidence rises to 0.71 and duration MAE improves, but probability calibration and most classification metrics regress.","rollback_reason":"Primary RPS worsened from 0.09263039 to 0.09395122.","next_action_hint":"Keep C=10 and test ordinal decomposition or text features instead of pushing regularization further."}}
{"run":7,"commit":"d9f0487","metric":0.09178938,"metrics":{"macro_f1":0.24876645,"weighted_kappa":0.3680357,"log_duration_mae":0.8599577,"evergreen_auc":0.92797784,"mean_confidence":0.63657444},"status":"keep","description":"Ordinal cumulative logistic classifiers over normalized embeddings","timestamp":1785097526376,"segment":0,"confidence":24.611607056521052,"asi":{"hypothesis":"Five cumulative boundary classifiers align training directly with the ordered structure measured by RPS.","learning":"Ordinal decomposition yields a small RPS gain and clear improvements in macro F1, kappa, and evergreen AUC over multinomial C=10; monotone tail probabilities prevent invalid negative class mass."}}
{"run":8,"commit":"d9f0487","metric":0.09760006,"metrics":{"macro_f1":0.24317447,"weighted_kappa":0.25262238,"log_duration_mae":0.91086351,"evergreen_auc":0.92763158,"mean_confidence":0.57836907},"status":"discard","description":"Increase ordinal boundary regularization with C=3","timestamp":1785097540741,"segment":0,"confidence":25.099810758651767,"asi":{"hypothesis":"More regularized cumulative classifiers may improve boundary calibration.","learning":"As with multinomial classification, C=3 underfits; RPS and ordered hard-label metrics regress materially.","rollback_reason":"Primary RPS regressed from 0.09178938 to 0.09760006.","next_action_hint":"Try weaker ordinal regularization around C=20 or add independent lexical temporal cues."}}
{"run":9,"commit":"58e35f5","metric":0.09039041,"metrics":{"macro_f1":0.24151074,"weighted_kappa":0.35368688,"log_duration_mae":0.84012113,"evergreen_auc":0.92520776,"mean_confidence":0.66857413},"status":"keep","description":"Reduce ordinal boundary regularization with C=20","timestamp":1785097552933,"segment":0,"confidence":24.882157955604754,"asi":{"hypothesis":"Ordinal boundary models may benefit from slightly sharper fits than C=10.","learning":"C=20 lowers RPS and duration MAE despite small declines in hard-label metrics and evergreen AUC; probability sharpness helps overall ordered calibration."}}
{"run":10,"commit":"58e35f5","metric":0.09061567,"metrics":{"macro_f1":0.24331363,"weighted_kappa":0.41824783,"log_duration_mae":0.82253121,"evergreen_auc":0.92105263,"mean_confidence":0.69961661},"status":"discard","description":"Test sharper ordinal boundary fits with C=40","timestamp":1785097569618,"segment":0,"confidence":30.25054400408165,"asi":{"hypothesis":"C=40 may improve class separation while preserving ordinal probability quality.","learning":"C=40 improves kappa and duration MAE but is slightly over-sharp for RPS and lowers evergreen AUC; C=20 is the calibration optimum in this range.","rollback_reason":"Primary RPS increased from 0.09039041 to 0.09061567.","next_action_hint":"Keep ordinal C=20; test text-only signals or an embedding/text ensemble."}}
{"run":11,"commit":"58e35f5","metric":0.09089613,"metrics":{"macro_f1":0.24151074,"weighted_kappa":0.35368688,"log_duration_mae":0.84700694,"evergreen_auc":0.92520776,"mean_confidence":0.65729949},"status":"discard","description":"Blend ordinal probabilities with 5% training class prior","timestamp":1785097599796,"segment":0,"confidence":38.57269715639092,"asi":{"hypothesis":"A small class-prior blend may reduce overconfidence and improve temporal-test calibration.","learning":"Prior smoothing worsens both RPS and duration MAE without changing hard decisions; the C=20 ordinal probabilities are not globally overconfident.","rollback_reason":"Primary RPS regressed from 0.09039041 to 0.09089613.","next_action_hint":"Do not apply global smoothing; add complementary lexical features."}}
{"run":12,"commit":"58e35f5","metric":0.10525204,"metrics":{"macro_f1":0.21948284,"weighted_kappa":0.24431818,"log_duration_mae":0.91537402,"evergreen_auc":0.8732687,"mean_confidence":0.65412502},"status":"discard","description":"Word TF-IDF multinomial classifier over titles and article bodies","timestamp":1785097622528,"segment":0,"confidence":27.375821575765837,"asi":{"hypothesis":"Explicit lexical date, deadline, and event words may predict horizon better than dense semantic embeddings.","learning":"Text-only word TF-IDF is much better than urgency but clearly worse than embeddings on RPS and every secondary metric; lexical cues may still be complementary in an ensemble.","rollback_reason":"Primary RPS was 0.10525204 versus 0.09039041 for ordinal embeddings.","next_action_hint":"Combine sparse TF-IDF with embeddings or blend text probabilities at low weight rather than replacing embeddings."}}
{"run":13,"commit":"58e35f5","metric":0.09203494,"metrics":{"macro_f1":0.24535569,"weighted_kappa":0.367194,"log_duration_mae":0.84838156,"evergreen_auc":0.92347645,"mean_confidence":0.66209017},"status":"discard","description":"Blend 20% word TF-IDF predictions into ordinal embeddings","timestamp":1785097660507,"segment":0,"confidence":38.57269715639092,"asi":{"hypothesis":"Lexical predictions may correct embedding errors when blended conservatively.","learning":"A 20% text blend slightly improves hard-label metrics but worsens RPS, duration MAE, and evergreen AUC; text errors are not complementary enough at this weight.","rollback_reason":"Primary RPS regressed from 0.09039041 to 0.09203494 and added substantial complexity.","next_action_hint":"If revisited, try direct feature concatenation or at most a very small text weight; prioritize simpler explicit temporal features."}}
{"run":14,"commit":"58e35f5","metric":0.09254488,"metrics":{"macro_f1":0.23840202,"weighted_kappa":0.35928393,"log_duration_mae":0.83545986,"evergreen_auc":0.9134349,"mean_confidence":0.68854044},"status":"discard","description":"Concatenate word TF-IDF with embeddings for ordinal classification","timestamp":1785097692308,"segment":0,"confidence":46.152082402928436,"asi":{"hypothesis":"Joint linear boundary models can use lexical cues only when they add information beyond embeddings.","learning":"Adding 5k TF-IDF features increases confidence and slightly improves duration MAE, but RPS and evergreen discrimination regress; sparse lexical detail overfits the small training set.","rollback_reason":"Primary RPS regressed from 0.09039041 to 0.09254488 with much higher feature dimensionality.","next_action_hint":"Use a tiny fixed temporal feature set instead of thousands of lexical dimensions."}}
{"run":15,"commit":"58e35f5","metric":0.09139687,"metrics":{"macro_f1":0.23880912,"weighted_kappa":0.43825189,"log_duration_mae":0.84058635,"evergreen_auc":0.90962604,"mean_confidence":0.66428792},"status":"discard","description":"Append fixed temporal phrase flags to ordinal embeddings","timestamp":1785097734515,"segment":0,"confidence":63.86056623252822,"asi":{"hypothesis":"A small hand-chosen multilingual temporal vocabulary may add deadline and recency cues missing from dense embeddings.","learning":"Temporal flags raise weighted kappa strongly but worsen RPS and evergreen AUC; binary phrase presence sharpens some hard decisions while harming probability ranking.","rollback_reason":"Primary RPS regressed from 0.09039041 to 0.09139687 and the added vocabulary increases maintenance complexity.","next_action_hint":"Avoid hand-maintained cue lists unless a much smaller or cross-validated formulation improves RPS."}}
{"run":16,"commit":"58e35f5","metric":0.09631414,"metrics":{"macro_f1":0.32114347,"weighted_kappa":0.52978918,"log_duration_mae":0.9098234,"evergreen_auc":0.92416898,"mean_confidence":0.60413203},"status":"discard","description":"Balance classes independently at each ordinal boundary","timestamp":1785097765754,"segment":0,"confidence":46.152082402928436,"asi":{"hypothesis":"Boundary class imbalance may suppress rare short horizons, so balanced losses could improve ordered predictions.","learning":"Full balancing greatly improves macro F1 and kappa but badly degrades RPS and duration calibration; optimized class frequencies encode useful priors that should not be erased.","rollback_reason":"Primary RPS regressed from 0.09039041 to 0.09631414.","next_action_hint":"If class reweighting is revisited, use a mild fractional correction rather than fully balanced weights."}}
{"run":17,"commit":"0d9fb56","metric":0.08901009,"metrics":{"macro_f1":0.24738972,"weighted_kappa":0.44117647,"log_duration_mae":0.84949742,"evergreen_auc":0.9248615,"mean_confidence":0.64638696},"status":"keep","description":"Apply quarter-power class balancing to ordinal boundaries","timestamp":1785097791785,"segment":0,"confidence":58.05475048884358,"asi":{"hypothesis":"A mild quarter-power correction can recover minority-boundary signal without discarding empirical class priors.","learning":"Fractional balancing lowers RPS by 0.00138 and substantially improves kappa, unlike full balancing; gentle prior correction is useful while alpha=1 is too aggressive."}}
{"run":18,"commit":"0d9fb56","metric":0.08952514,"metrics":{"macro_f1":0.2507582,"weighted_kappa":0.43700867,"log_duration_mae":0.84445104,"evergreen_auc":0.92347645,"mean_confidence":0.65689251},"status":"discard","description":"Reduce ordinal class-balance correction exponent to one eighth","timestamp":1785097814244,"segment":0,"confidence":49.44806187401615,"asi":{"hypothesis":"A smaller imbalance correction may retain more calibration while still helping rare boundaries.","learning":"Alpha 0.125 gives slightly better macro F1 and MAE but worse RPS than alpha 0.25; the stronger quarter-power correction better matches ordered probability errors.","rollback_reason":"Primary RPS increased from 0.08901009 to 0.08952514.","next_action_hint":"Test alpha 0.375 to locate whether the optimum lies above 0.25."}}
{"run":19,"commit":"52aef73","metric":0.08881373,"metrics":{"macro_f1":0.29284085,"weighted_kappa":0.49358342,"log_duration_mae":0.85430795,"evergreen_auc":0.92416898,"mean_confidence":0.63846897},"status":"keep","description":"Increase ordinal class-balance correction exponent to three eighths","timestamp":1785097837547,"segment":0,"confidence":43.12882566048742,"asi":{"hypothesis":"A slightly stronger fractional balance than one quarter may improve rare-boundary ranking without the calibration damage of full balancing.","learning":"Alpha 0.375 gives a small RPS gain and large macro F1/kappa gains; the calibration optimum is between mild and full balancing."}}
{"run":20,"commit":"52aef73","metric":0.08930326,"metrics":{"macro_f1":0.28942816,"weighted_kappa":0.49229068,"log_duration_mae":0.86304261,"evergreen_auc":0.92451524,"mean_confidence":0.6292059},"status":"discard","description":"Use square-root class balancing at ordinal boundaries","timestamp":1785097858124,"segment":0,"confidence":45.28893386328936,"asi":{"hypothesis":"Square-root balancing may be the midpoint between empirical and fully balanced boundary priors.","learning":"Alpha 0.5 passes the optimum: RPS, macro F1, kappa, and MAE all regress versus alpha 0.375 despite a negligible AUC gain.","rollback_reason":"Primary RPS increased from 0.08881373 to 0.08930326.","next_action_hint":"Keep alpha 0.375; tune model regularization jointly or test another representation."}}
{"run":21,"commit":"52aef73","metric":0.08988059,"metrics":{"macro_f1":0.29184385,"weighted_kappa":0.48929275,"log_duration_mae":0.87956086,"evergreen_auc":0.92797784,"mean_confidence":0.59807972},"status":"discard","description":"Increase regularization for fractionally balanced ordinal models with C=10","timestamp":1785097881120,"segment":0,"confidence":51.89172045581336,"asi":{"hypothesis":"Fractional class weighting may require stronger regularization than the unweighted optimum.","learning":"C=10 underfits ordered probabilities and duration, though it slightly improves evergreen AUC; alpha 0.375 still prefers C=20.","rollback_reason":"Primary RPS regressed from 0.08881373 to 0.08988059.","next_action_hint":"Test C=30 or 40 with alpha 0.375 to bracket the joint optimum."}}
{"run":22,"commit":"52aef73","metric":0.08883036,"metrics":{"macro_f1":0.24834933,"weighted_kappa":0.47222222,"log_duration_mae":0.84107886,"evergreen_auc":0.92347645,"mean_confidence":0.6616279},"status":"discard","description":"Reduce regularization for fractionally balanced ordinal models with C=30","timestamp":1785097899552,"segment":0,"confidence":52.13768034716342,"asi":{"hypothesis":"A sharper C=30 fit may improve the fractionally balanced boundary probabilities.","learning":"C=30 is effectively tied but marginally worse on RPS and clearly worse on macro F1/kappa; C=20 remains simpler and better calibrated.","rollback_reason":"Primary RPS increased by 0.00001663 and no secondary tradeoff justified keeping it.","next_action_hint":"Stop tuning C around 20; test PCA, centroids, or urgency blending."}}
{"run":23,"commit":"52aef73","metric":0.09085884,"metrics":{"macro_f1":0.27877385,"weighted_kappa":0.47645963,"log_duration_mae":0.87700363,"evergreen_auc":0.91620499,"mean_confidence":0.61972799},"status":"discard","description":"Append production urgency probability to embedding features","timestamp":1785097922389,"segment":0,"confidence":57.519450234957404,"asi":{"hypothesis":"The separately trained urgency probability may add a compact orthogonal signal to semantic embeddings.","learning":"Urgency adds no useful information beyond the same underlying embeddings and degrades RPS, duration MAE, and evergreen AUC.","rollback_reason":"Primary RPS regressed from 0.08881373 to 0.09085884.","next_action_hint":"Do not reuse production urgency in the intrinsic model; focus on representation geometry."}}
{"run":24,"commit":"52aef73","metric":0.09300428,"metrics":{"macro_f1":0.26341463,"weighted_kappa":0.47134697,"log_duration_mae":0.90773994,"evergreen_auc":0.91828255,"mean_confidence":0.60435986},"status":"discard","description":"Whiten embeddings through 64-component PCA before ordinal classification","timestamp":1785097947174,"segment":0,"confidence":58.85019701406212,"asi":{"hypothesis":"PCA whitening may remove noisy embedding directions and improve temporal generalization.","learning":"Compressing to 64 whitened components loses useful lifetime structure and worsens every probability-sensitive metric; L2 regularization in the full embedding space is preferable.","rollback_reason":"Primary RPS regressed from 0.08881373 to 0.09300428.","next_action_hint":"Avoid aggressive dimensionality reduction; try a distance-based or ridge-regression ordinal model."}}
{"run":25,"commit":"52aef73","metric":0.09507454,"metrics":{"macro_f1":0.24705763,"weighted_kappa":0.26812998,"log_duration_mae":0.89484977,"evergreen_auc":0.93109418,"mean_confidence":0.57627232},"status":"discard","description":"Ridge regression on cumulative horizon targets with alpha=1","timestamp":1785097972049,"segment":0,"confidence":51.89172045581336,"asi":{"hypothesis":"Multi-output ridge regression directly minimizes the squared cumulative errors used by RPS.","learning":"Direct squared-loss cumulative regression improves evergreen AUC but underfits class ordering and trails logistic boundaries on RPS; alpha=1 may be too strong.","rollback_reason":"Primary RPS regressed from 0.08881373 to 0.09507454.","next_action_hint":"Try weaker ridge alpha once because the direct objective is promising, then abandon if still behind."}}
{"run":26,"commit":"52aef73","metric":0.09467247,"metrics":{"macro_f1":0.27029785,"weighted_kappa":0.42824074,"log_duration_mae":0.88354494,"evergreen_auc":0.90339335,"mean_confidence":0.61950742},"status":"discard","description":"Reduce cumulative ridge regularization to alpha=0.1","timestamp":1785098026577,"segment":0,"confidence":50.342317199739405,"asi":{"hypothesis":"A weaker ridge penalty may recover the semantic boundary detail lost at alpha=1.","learning":"Alpha 0.1 improves hard ordering versus alpha=1 but barely improves RPS and sharply harms evergreen AUC; squared-loss regression is inferior to logistic boundaries here.","rollback_reason":"Primary RPS remains far above the 0.08881373 logistic result.","next_action_hint":"Abandon ridge; spend remaining runs on nearest-centroid evidence or conservative refinements to the best model."}}
{"run":27,"commit":"52aef73","metric":0.11808058,"metrics":{"macro_f1":0.23145851,"weighted_kappa":0.34972158,"log_duration_mae":0.7795305,"evergreen_auc":0.89889197,"mean_confidence":0.94674657},"status":"discard","description":"Shrinkage linear discriminant analysis over normalized embeddings","timestamp":1785098048052,"segment":0,"confidence":48.882756756959644,"asi":{"hypothesis":"Covariance-aware linear discriminant analysis may exploit embedding geometry beyond independent logistic boundaries.","learning":"Shrinkage LDA is extremely overconfident (0.95) and has poor RPS despite excellent expected-duration MAE; its probabilities are unsuitable without heavy calibration.","rollback_reason":"Primary RPS regressed catastrophically to 0.11808058.","next_action_hint":"Do not pursue covariance models on 266 rows; retain regularized logistic boundaries."}}
