{"run":53,"commit":"ab97fcb","metric":0.08789563,"metrics":{"macro_f1":0.28942816,"weighted_kappa":0.49229068,"log_duration_mae":0.85315078,"evergreen_auc":0.92520776,"mean_confidence":0.60509946},"status":"discard","description":"Move 10% probability mass to adjacent horizons","timestamp":1785103268223,"segment":1,"confidence":0.3682098216317505,"asi":{"hypothesis":"Adjacent-class smoothing can express teacher horizon uncertainty without moving mass to semantically distant classes.","learning":"Smoothing nominally lowers RPS by only 0.000028 and raises AUC, but worsens F1, kappa, and MAE; the tiny gain is not robust enough to justify a fixed smoothing constant.","rollback_reason":"Discarded a sub-noise, test-specific primary gain under the 0.001 simplicity and anti-overfitting rule.","next_action_hint":"Do not tune smoothing strength on this holdout."}}
{"run":54,"commit":"ab97fcb","metric":0.19479953,"metrics":{"macro_f1":0.10505051,"weighted_kappa":-0.024542,"log_duration_mae":1.90694515,"evergreen_auc":0.87188366,"mean_confidence":0.24633309},"status":"discard","description":"Regularized 32-unit MLP over embeddings","timestamp":1785103293315,"segment":1,"confidence":0.36132833118143287,"asi":{"hypothesis":"A tiny hidden layer may capture semantic interactions while early stopping controls overfitting.","learning":"The MLP severely underfits the small imbalanced dataset and produces nearly uninformative probabilities; neural fine-tuning is unsupported at this sample size.","rollback_reason":"Primary RPS regressed catastrophically to 0.19479953.","next_action_hint":"Do not tune neural architectures in this local benchmark."}}
{"run":55,"commit":"ab97fcb","metric":0.09088882,"metrics":{"macro_f1":0.2706144,"weighted_kappa":0.5032235,"log_duration_mae":0.86234627,"evergreen_auc":0.89231302,"mean_confidence":0.65429308},"status":"discard","description":"Proportional-odds logistic model with shared semantic slope","timestamp":1785103329183,"segment":1,"confidence":0.3587270235407914,"asi":{"hypothesis":"A proper proportional-odds model can reduce variance by sharing one embedding direction across all horizon thresholds.","learning":"Shared slopes retain ordered hard predictions but sharply reduce evergreen AUC and worsen RPS; different horizon boundaries require distinct semantic directions.","rollback_reason":"Primary RPS regressed from 0.08792380 to 0.09088882 with more data reshaping complexity.","next_action_hint":"Keep independent boundary coefficients; shared-slope ordinal models are too restrictive."}}
{"run":56,"commit":"ab97fcb","metric":0.08935971,"metrics":{"macro_f1":0.2482326,"weighted_kappa":0.36999596,"log_duration_mae":0.84523141,"evergreen_auc":0.92416898,"mean_confidence":0.66809747},"status":"discard","description":"Non-ensemble five-fold sigmoid boundary calibration","timestamp":1785103361094,"segment":1,"confidence":0.3634065716426645,"asi":{"hypothesis":"Cross-validated sigmoid calibration with a final full-data estimator may avoid the signal loss of fold-ensemble calibration.","learning":"Full-data calibrated estimators improve over fold ensembles but still worsen RPS and hard-label quality; logistic outputs plus PAVA are better calibrated directly.","rollback_reason":"Primary RPS regressed from 0.08792380 to 0.08935971 and fitting cost/complexity rose.","next_action_hint":"Close probability calibration variants on this sample size."}}
{"run":57,"commit":"ab97fcb","metric":0.09832329,"metrics":{"macro_f1":0.25756573,"weighted_kappa":0.44645767,"log_duration_mae":0.80428807,"evergreen_auc":0.90720222,"mean_confidence":0.77572899},"status":"discard","description":"Modified-Huber SGD classifiers at ordinal boundaries","timestamp":1785103391847,"segment":1,"confidence":0.3587270235407914,"asi":{"hypothesis":"Modified-Huber loss may resist noisy teacher labels while preserving decisive semantic boundaries.","learning":"Robust margins produce excellent expected-duration MAE but severe overconfidence and worse RPS/AUC; probability quality, not boundary location, is the failure.","rollback_reason":"Primary RPS regressed from 0.08792380 to 0.09832329.","next_action_hint":"Do not tune SGD losses; log-loss remains necessary for calibrated probabilities."}}
{"run":58,"commit":"ab97fcb","metric":0.09195317,"metrics":{"macro_f1":0.23185787,"weighted_kappa":0.36390855,"log_duration_mae":0.85628541,"evergreen_auc":0.91551247,"mean_confidence":0.63034093},"status":"discard","description":"RBF kernel ridge on cumulative horizon targets","timestamp":1785103419346,"segment":1,"confidence":0.3268304865015732,"asi":{"hypothesis":"Kernel ridge can optimize squared cumulative targets directly while modeling smooth non-linear semantic effects.","learning":"Non-linear Brier regression improves over linear ridge but still trails logistic boundaries on RPS and all classification metrics; direct squared loss remains less effective.","rollback_reason":"Primary RPS regressed from 0.08792380 to 0.09195317.","next_action_hint":"Do not tune kernel parameters against the fixed test set."}}
{"run":59,"commit":"ab97fcb","metric":0.09477514,"metrics":{"macro_f1":0.24798037,"weighted_kappa":0.35137386,"log_duration_mae":0.88581315,"evergreen_auc":0.91551247,"mean_confidence":0.62643499},"status":"discard","description":"One-vs-rest logistic classifiers for exact horizons","timestamp":1785103444608,"segment":1,"confidence":0.3001430007217481,"asi":{"hypothesis":"Independent exact-class classifiers may preserve rare-class evidence better than multinomial competition.","learning":"One-vs-rest exact classes underperform cumulative boundaries on every metric; explicitly encoding order remains essential.","rollback_reason":"Primary RPS regressed from 0.08792380 to 0.09477514.","next_action_hint":"Close unordered exact-class formulations."}}
{"run":60,"commit":"ab97fcb","metric":0.08992154,"metrics":{"macro_f1":0.28086916,"weighted_kappa":0.46860987,"log_duration_mae":0.89166034,"evergreen_auc":0.92313019,"mean_confidence":0.5910537},"status":"discard","description":"Five-percent soft targets at ordinal boundaries","timestamp":1785103474411,"segment":1,"confidence":0.3268304865015732,"asi":{"hypothesis":"Soft binary targets can absorb teacher-label uncertainty during fitting rather than post-hoc smoothing.","learning":"Training label smoothing makes boundaries too diffuse and worsens RPS, MAE, and hard-label metrics; direct hard pseudo-labels generalize better.","rollback_reason":"Primary RPS regressed from 0.08792380 to 0.08992154.","next_action_hint":"Do not tune smoothing strength on this holdout."}}
{"run":61,"commit":"ab97fcb","metric":0.08826954,"metrics":{"macro_f1":0.25899403,"weighted_kappa":0.50862069,"log_duration_mae":0.86366233,"evergreen_auc":0.93074792,"mean_confidence":0.62402552},"status":"discard","description":"ANOVA-select 256 embedding dimensions before ordinal fitting","timestamp":1785103508359,"segment":1,"confidence":0.3587270235407914,"asi":{"hypothesis":"Supervised filtering may remove embedding dimensions unrelated to horizon while preserving broad semantic axes.","learning":"ANOVA selection improves evergreen AUC and kappa but worsens RPS, macro F1, and MAE; univariate class association discards useful distributed calibration signal.","rollback_reason":"Primary RPS regressed and choosing feature counts on this holdout would overfit.","next_action_hint":"Do not sweep feature counts; retain all embedding dimensions."}}
{"run":62,"commit":"ab97fcb","metric":0.08931208,"metrics":{"macro_f1":0.29184385,"weighted_kappa":0.46755336,"log_duration_mae":0.85171055,"evergreen_auc":0.92416898,"mean_confidence":0.64155157},"status":"discard","description":"Prior-smooth semantically unfamiliar test articles","timestamp":1785103543146,"segment":1,"confidence":0.3681740234863853,"asi":{"hypothesis":"Test articles outside the training embedding neighborhood should receive more conservative class-prior probabilities.","learning":"Cosine unfamiliarity is not a useful calibration proxy: adaptive smoothing worsens RPS, kappa, and MAE while leaving AUC unchanged.","rollback_reason":"Primary RPS regressed and transductive distance logic adds complexity.","next_action_hint":"Close abstention-by-embedding-distance; model confidence is not improved by local density."}}
{"run":63,"commit":"ab97fcb","metric":0.08760074,"metrics":{"macro_f1":0.29691358,"weighted_kappa":0.51039462,"log_duration_mae":0.84321966,"evergreen_auc":0.92970914,"mean_confidence":0.64311337},"status":"discard","description":"Append smoothed feed-level cumulative horizon priors","timestamp":1785103578317,"segment":1,"confidence":0.3682098216317505,"asi":{"hypothesis":"Smoothed source-level horizon rates may add stable context without the high variance of one-hot feed coefficients.","learning":"Target-encoded feed priors improve every quality metric, including RPS by 0.00032, but the gain is below the 0.001 simplicity threshold and relies on source-specific history rather than article semantics.","rollback_reason":"Discarded to avoid benchmark/source overfitting and roughly doubling code for a sub-threshold gain.","next_action_hint":"Reconsider source priors only on a larger external holdout where unseen-feed behavior can be measured."}}
{"run":64,"commit":"5308f94","metric":0.08792375,"metrics":{"macro_f1":0.29284085,"weighted_kappa":0.49358342,"log_duration_mae":0.84456737,"evergreen_auc":0.92416898,"mean_confidence":0.64355396},"status":"keep","description":"Remove redundant embedding normalization","timestamp":1785103606511,"segment":1,"confidence":0.4031939111820844,"asi":{"hypothesis":"Frozen EmbeddingGemma vectors may already be unit-normalized, making runtime normalization redundant.","learning":"Raw and normalized embeddings produce metrics equal to numerical precision, while removing an import and two preprocessing calls; the simpler candidate is preferable under the 0.001 equivalence rule."}}
{"run":65,"commit":"3133ea0","metric":0.08792375,"metrics":{"macro_f1":0.29284085,"weighted_kappa":0.49358342,"log_duration_mae":0.84456737,"evergreen_auc":0.92416898,"mean_confidence":0.64355396},"status":"keep","description":"Remove unused logistic random seed","timestamp":1785103633929,"segment":1,"confidence":0.44548225789497337,"asi":{"hypothesis":"The deterministic LBFGS solver does not use LogisticRegression.random_state.","learning":"All metrics remain bit-for-bit identical after removing the unused argument; deterministic behavior is preserved with less configuration."}}
{"run":66,"commit":"4c9f6cb","metric":0.08792375,"metrics":{"macro_f1":0.29284085,"weighted_kappa":0.49358342,"log_duration_mae":0.84456737,"evergreen_auc":0.92416898,"mean_confidence":0.64355396},"status":"keep","description":"Use default logistic iteration limit","timestamp":1785103656913,"segment":1,"confidence":0.5127883058591718,"asi":{"hypothesis":"The five small LBFGS fits converge within sklearn's default iteration limit.","learning":"All metrics remain identical and checks emit no convergence warning; the explicit 2000-iteration override was unnecessary."}}
{"run":67,"commit":"ecba58a","metric":0.08738499,"metrics":{"macro_f1":0.29284085,"weighted_kappa":0.49358342,"log_duration_mae":0.8447866,"evergreen_auc":0.92520776,"mean_confidence":0.64302667},"status":"keep","description":"Remove per-boundary logistic intercepts","timestamp":1785103695682,"segment":1,"confidence":0.9697220619676244,"asi":{"hypothesis":"Fractional class weights already encode boundary priors, so free intercepts may redundantly fit the small teacher sample.","learning":"Disabling intercepts removes five fitted parameters while lowering RPS by 0.00054 and improving evergreen AUC with unchanged hard predictions; the simpler constrained model generalizes better."}}
{"run":68,"commit":"ecba58a","metric":0.08738499,"metrics":{"macro_f1":0.29284085,"weighted_kappa":0.49358342,"log_duration_mae":0.8447866,"evergreen_auc":0.92520776,"mean_confidence":0.64302667},"status":"discard","description":"Determinism check for intercept-free ordinal model","timestamp":1785103709539,"segment":1,"confidence":0.9727823301321238,"asi":{"hypothesis":"The intercept-free gain should reproduce exactly before further changes.","learning":"All metrics reproduce bit-for-bit, confirming the constrained solver is deterministic.","rollback_reason":"No code change or new primary improvement; validation run only.","next_action_hint":"Continue seeking parameter-removing constraints rather than adding features."}}
{"run":69,"commit":"ecba58a","metric":0.08960879,"metrics":{"macro_f1":0.24516796,"weighted_kappa":0.36089699,"log_duration_mae":0.83485333,"evergreen_auc":0.92520776,"mean_confidence":0.66970162},"status":"discard","description":"Remove fractional class balancing","timestamp":1785103737550,"segment":1,"confidence":0.9697220619676244,"asi":{"hypothesis":"The intercept-free model may make explicit class weighting unnecessary, enabling a much smaller candidate.","learning":"Removing weights improves duration MAE but degrades RPS by 0.00222 and sharply harms macro F1/kappa; fractional balancing remains essential beyond the simplicity tolerance.","rollback_reason":"Primary regression exceeds the 0.001 equivalence threshold despite fewer lines.","next_action_hint":"Retain fractional weights; simplify only arguments that are demonstrably redundant."}}
{"run":70,"commit":"26359f7","metric":0.0883542,"metrics":{"macro_f1":0.29284085,"weighted_kappa":0.49358342,"log_duration_mae":0.85474241,"evergreen_auc":0.92520776,"mean_confidence":0.63784063},"status":"keep","description":"Replace isotonic projection with cumulative clipping","timestamp":1785103772881,"segment":1,"confidence":0.9821847792088149,"asi":{"hypothesis":"The original one-line cumulative clipping may be preferable if its RPS remains within the session's explicit 0.001 simplicity tolerance.","learning":"Removing isotonic regression costs 0.000969 RPS with identical F1, kappa, and AUC, while deleting an import and multi-row projection; this is just inside the declared equivalence threshold.","tradeoff":"Accepted a bounded primary regression to follow the prompt's explicit preference for less code when RPS differs by under 0.001."}}
{"run":71,"commit":"c4e6854","metric":0.0883542,"metrics":{"macro_f1":0.29284085,"weighted_kappa":0.49358342,"log_duration_mae":0.85474241,"evergreen_auc":0.92520776,"mean_confidence":0.63784063},"status":"keep","description":"Generate boundary class weights from counts","timestamp":1785103797844,"segment":1,"confidence":0.9949720047912183,"asi":{"hypothesis":"A count-driven comprehension can express the same fractional balancing without duplicated formulas and named positive/negative variables.","learning":"Metrics remain identical; the shorter symmetric weight construction is behavior-preserving."}}
{"run":72,"commit":"c4e6854","metric":0.09210295,"metrics":{"macro_f1":0.2985007,"weighted_kappa":0.50396804,"log_duration_mae":0.86551376,"evergreen_auc":0.93282548,"mean_confidence":0.58004961},"status":"discard","description":"Smooth neighboring ordinal boundary coefficients","timestamp":1785103904465,"segment":1,"confidence":0.9821847792088149,"asi":{"hypothesis":"A fixed three-point average across neighboring boundary coefficient vectors may reduce variance while retaining boundary-specific semantic directions.","learning":"Coefficient sharing improves macro F1, kappa, and evergreen AUC but makes probabilities too diffuse and worsens RPS/MAE; independent boundary slopes are needed for calibration.","rollback_reason":"Primary RPS regressed from 0.08835420 to 0.09210295 and added substantial post-fit logic.","next_action_hint":"Do not tune the smoothing weight on this holdout; retain independent coefficients."}}
